subreddit_topic,subreddit_time_created,subreddit_title,subreddit_id,subreddit_score,subreddit_num_comments,subreddit_body,subreddit_url
dadjokes,2020-08-22 11:25:22,What s old and cold ,ieewhz,0,0,An iceberg,https://www.reddit.com/r/dadjokes/comments/ieewhz/whats_old_and_cold/
dadjokes,2020-08-21 19:40:10,Working in a mirror factory ,ie07io,20,1,Is something I could really see myself doing,https://www.reddit.com/r/dadjokes/comments/ie07io/working_in_a_mirror_factory/
dadjokes,2020-08-22 01:33:07,I used to have an addiction to the hokey pokey,ie6vsz,7,0,Thankfully  I turned myself around,https://www.reddit.com/r/dadjokes/comments/ie6vsz/i_used_to_have_an_addiction_to_the_hokey_pokey/
dadjokes,2020-08-21 21:03:39,Be there,ie1u9b,14,7,Or                                                                                                                                                                                                            ,https://www.reddit.com/r/dadjokes/comments/ie1u9b/be_there/
dadjokes,2020-08-21 21:11:58,I tried to organize a professional Hide and Seek tournament  but it was a complete disaster ,ie2067,13,2,Good players are hard to find,https://www.reddit.com/r/dadjokes/comments/ie2067/i_tried_to_organize_a_professional_hide_and_seek/
dadjokes,2020-08-22 10:39:23,Nurse  Sorry for the waiting,ieeeky,1,2,don t worry  I m patient,https://www.reddit.com/r/dadjokes/comments/ieeeky/nurse_sorry_for_the_waiting/
dadjokes,2020-08-21 20:19:11,A snake walked into a bar,ie0zch,13,2,The bartender said  how did you do that  ,https://www.reddit.com/r/dadjokes/comments/ie0zch/a_snake_walked_into_a_bar/
dadjokes,2020-08-21 18:52:22,Why s it called  Canada  ,idz9tb,20,4,Because when they were first asked to spell it  they said  C  eh  N  eh  D  eh ,https://www.reddit.com/r/dadjokes/comments/idz9tb/whys_it_called_canada/
dadjokes,2020-08-21 00:51:57,If you commit a 1st degree murder in Canada,idjqsg,499,12,is it a 34 degree murder in the US,https://www.reddit.com/r/dadjokes/comments/idjqsg/if_you_commit_a_1st_degree_murder_in_canada/
dadjokes,2020-08-22 03:45:44,What is it called when you kill a good friend of yours ,ie90xx,3,2, Homiecide,https://www.reddit.com/r/dadjokes/comments/ie90xx/what_is_it_called_when_you_kill_a_good_friend_of/
dadjokes,2020-08-22 01:55:04,I named our dog   Doggy ,ie795h,5,1,But my wife won t let me name our Cat  Style  We are both missionaries and i just wanted to spice things up,https://www.reddit.com/r/dadjokes/comments/ie795h/i_named_our_dog_doggy/
dadjokes,2020-08-22 01:39:17,I ve never trusted stairs,ie6zoe,5,0,They re always up to something,https://www.reddit.com/r/dadjokes/comments/ie6zoe/ive_never_trusted_stairs/
dadjokes,2020-08-22 05:10:32,I wasn t sure if I liked leeches at first ,iea9tb,0,1,Then they grew on me,https://www.reddit.com/r/dadjokes/comments/iea9tb/i_wasnt_sure_if_i_liked_leeches_at_first/
dadjokes,2020-08-22 00:11:11,Who can drink 6 liters of gasoline and not get sick ,ie5f8t,6,1,Jerry can,https://www.reddit.com/r/dadjokes/comments/ie5f8t/who_can_drink_6_liters_of_gasoline_and_not_get/
dadjokes,2020-08-22 00:07:59,To be frank,ie5d5d,6,1,I would need to get a new ID,https://www.reddit.com/r/dadjokes/comments/ie5d5d/to_be_frank/
dadjokes,2020-08-22 18:35:20,John  I want a divorce ,iekiza,0,1,Divorce  heheheheheheheh,https://www.reddit.com/r/dadjokes/comments/iekiza/john_i_want_a_divorce/
dadjokes,2020-08-22 02:52:10,What do you call a shape with one vertex ,ie86yw,3,2,A unicorner,https://www.reddit.com/r/dadjokes/comments/ie86yw/what_do_you_call_a_shape_with_one_vertex/
dadjokes,2020-08-21 23:35:49,What s green and mean and stabs you when you hug It,ie4rm6,5,1,Cactus,https://www.reddit.com/r/dadjokes/comments/ie4rm6/whats_green_and_mean_and_stabs_you_when_you_hug_it/
dadjokes,2020-08-22 08:16:46,How do you stop an elephant from charging  ,iecsqa,0,3,Take away its credit cards,https://www.reddit.com/r/dadjokes/comments/iecsqa/how_do_you_stop_an_elephant_from_charging/
dadjokes,2020-08-21 21:36:20,Did you hear about the time the lead singer of the band  The Police  went undercover to catch a criminal ,ie2h5g,7,0,It was a Sting operation,https://www.reddit.com/r/dadjokes/comments/ie2h5g/did_you_hear_about_the_time_the_lead_singer_of/
dadjokes,2020-08-22 00:27:30,Tupperware     Tupperware     ,ie5ptl,4,0,Ah Tupperhere,https://www.reddit.com/r/dadjokes/comments/ie5ptl/tupperware_tupperware/
dadjokes,2020-08-21 15:25:11,With so many sporting events canceled  they re going to televise the World Origami Championship ,idvqq8,21,5,It s on Paperview,https://www.reddit.com/r/dadjokes/comments/idvqq8/with_so_many_sporting_events_canceled_theyre/
dadjokes,2020-08-21 23:04:57,You know that air that is generated by helicopter rotors when they are spinning really fast  Did you know that it s not normal air ,ie46cg,3,1,It s helicopt air,https://www.reddit.com/r/dadjokes/comments/ie46cg/you_know_that_air_that_is_generated_by_helicopter/
dadjokes,2020-08-22 04:01:25,Gas from farts should be spelled   ,ie997q,2,1,Gass,https://www.reddit.com/r/dadjokes/comments/ie997q/gas_from_farts_should_be_spelled/
dadjokes,2020-08-21 20:58:41,The seven dwarves have been told they can only gather in groups of 6   ,ie1qtl,7,2,    One of them isn t Happy,https://www.reddit.com/r/dadjokes/comments/ie1qtl/the_seven_dwarves_have_been_told_they_can_only/
dadjokes,2020-08-21 19:36:34,I came out of the bathroom with a sad look on my face and turned to my wife,ie050j,11,0, I guess my dad was right after all         I am full of shit ,https://www.reddit.com/r/dadjokes/comments/ie050j/i_came_out_of_the_bathroom_with_a_sad_look_on_my/
dadjokes,2020-08-21 20:52:40,My brother has gone into business fixing car ignitions ,ie1mpl,6,1,It s a start up,https://www.reddit.com/r/dadjokes/comments/ie1mpl/my_brother_has_gone_into_business_fixing_car/
dadjokes,2020-08-21 05:14:18,A man goes to his church to ask the priest a question ,ido39w,128,2,  How much does it cost to get a church singing group   the man asks    The priest replies   you mean  a choir     Uh  okay  I didn t think that mattered  How much does it cost to  acquire  a church singing group  ,https://www.reddit.com/r/dadjokes/comments/ido39w/a_man_goes_to_his_church_to_ask_the_priest_a/
dadjokes,2020-08-21 21:40:45,I just got back from an animal park and I was disappointed there was only a small dog there ,ie2k95,5,0,It was a shih tzu,https://www.reddit.com/r/dadjokes/comments/ie2k95/i_just_got_back_from_an_animal_park_and_i_was/
dadjokes,2020-08-21 15:07:17,Hey  German speakers  What do Germans call Mayor McCheese ,idvhlh,20,8,   Bürgermeister    ,https://www.reddit.com/r/dadjokes/comments/idvhlh/hey_german_speakers_what_do_germans_call_mayor/
dadjokes,2020-08-21 23:42:53,What s a computers faveourite snack ,ie4wfu,3,1,Microchips,https://www.reddit.com/r/dadjokes/comments/ie4wfu/whats_a_computers_faveourite_snack/
dadjokes,2020-08-22 03:26:50,Did you hear about the famous Spanish streaker ,ie8qn5,1,0,Senor Willy,https://www.reddit.com/r/dadjokes/comments/ie8qn5/did_you_hear_about_the_famous_spanish_streaker/
dadjokes,2020-08-22 07:00:48,What is long  skinny  slimy  hard headed and something your mother can t live without ,iebt79,0,1, me  your father     Your mother suggested I try some self deprecating humor,https://www.reddit.com/r/dadjokes/comments/iebt79/what_is_long_skinny_slimy_hardheaded_and/
dadjokes,2020-08-21 23:25:43,What do you do when you think your gun is broken,ie4kqy,4,1,Trouble shoot,https://www.reddit.com/r/dadjokes/comments/ie4kqy/what_do_you_do_when_you_think_your_gun_is_broken/
dadjokes,2020-08-21 13:19:38,How do you make the candles on your cake really happy ,idu604,26,2,Just blow them out  They ll be delighted,https://www.reddit.com/r/dadjokes/comments/idu604/how_do_you_make_the_candles_on_your_cake_really/
dadjokes,2020-08-21 21:59:53,Why do ants never get sick ,ie2xbe,5,0,Because they have anty bodies,https://www.reddit.com/r/dadjokes/comments/ie2xbe/why_do_ants_never_get_sick/
dadjokes,2020-08-21 21:52:41,My friend from high school became an engineer or something ,ie2sej,5,0,He would design vehicles and stuff like no other   One day he called me and said he had a very special design planned for his next vehicle   So I asked him   What s the big design you re working on    He said   Its a secret  You ll find out later    A few months later  he sends me a picture of this amazing motorbike that s entirely made of wood and nothing else  I called him back and told him I really liked it and if I could ride it   He replied in a deep and depressing voice   You can t I m sorry  I threw it away    I asked him why he threw away such a masterpiece he worked so hard to make   He replied   I tried everything      But it just wooden start  ,https://www.reddit.com/r/dadjokes/comments/ie2sej/my_friend_from_high_school_became_an_engineer_or/
dadjokes,2020-08-22 06:32:22,I used to be addicted to the hokey pokey,iebf7m,1,2,But then i turned myself around,https://www.reddit.com/r/dadjokes/comments/iebf7m/i_used_to_be_addicted_to_the_hokey_pokey/
dadjokes,2020-08-21 22:58:02,Out air conditioning just went out  it s 81 F in the house  My dog is looking at me like   ,ie41cb,5,1, This is not cool    ,https://www.reddit.com/r/dadjokes/comments/ie41cb/out_air_conditioning_just_went_out_its_81f_in_the/
dadjokes,2020-08-21 22:48:02,The doctor comes to a woman who has woken up from a coma  he says   I am sorry to inform you that you only have one left leg     ,ie3und,5,1, She  desperate  says   But doctor  I need to have two legs     The doctor replies       because the other leg is the right leg ,https://www.reddit.com/r/dadjokes/comments/ie3und/the_doctor_comes_to_a_woman_who_has_woken_up_from/
dadjokes,2020-08-21 15:58:15,I want to make a joke about a church,idw85t,13,2,But I got nun,https://www.reddit.com/r/dadjokes/comments/idw85t/i_want_to_make_a_joke_about_a_church/
dadjokes,2020-08-22 06:02:59,I have a problem where I keep putting footwear on the sides of my head ,ieb0j5,1,1,It s a real earshoe,https://www.reddit.com/r/dadjokes/comments/ieb0j5/i_have_a_problem_where_i_keep_putting_footwear_on/
dadjokes,2020-08-22 05:47:44,Pickup lines post covid ,ieat0x,0,2,Hey bub  want to self quarantine each other in my bubble,https://www.reddit.com/r/dadjokes/comments/ieat0x/pickup_lines_postcovid/
dadjokes,2020-08-21 22:14:11,A captain and his crew   Hopefully hasn t been posted before lol ,ie37f9,6,1,Once upon a time there was a pirate captain who was the most amazing best captain a crew could ever ask for  His crew loved him more than anything and would do absolutely anything for him    One day as they were sailing  a crew member In the crows nest shouts   one ship off the port side   Immediately the captain yells at his crew   Men  Bring me my red shirt    Slightly confused  the men hesitate for a second and then hurry off to bring the captain his red shirt  Amazingly they win the battle   The men are so happy and thankful their captain brought them safely through the battle they don t even care why the captain wanted his red shirt    A few months of sailing some more  again the man in the crows nest yells   Two ships off the port side   Quickly the captain screams   Men  Bring me my red shirt   The crew doesn t hesitate this time to get him his red shirt and what do you know  They win this battle too    The crew is astounded at their captains awesomeness    They honestly could not find anyone better  This time though the crew stops a moment and asks the captain   Why do you always have us bring you your red shirt    The captain replies   Well men  if I get stabbed the blood will blend into my red shirt and it will look like I m not hurt so that you will all fight as hard as if I were still alive    The men can t believe what they hear  How could they be so lucky as to have a captain so incredibly smart and courageous      Two seconds later   TWENTY SEVEN SHIPS OFF THE PORT SIDE          Calmly  with an even tone  the captain says   Men  bring me my brown pants  ,https://www.reddit.com/r/dadjokes/comments/ie37f9/a_captain_and_his_crew_hopefully_hasnt_been/
dadjokes,2020-08-21 18:58:54,What day do chickens hate the most ,idzea5,8,0,The Fry days,https://www.reddit.com/r/dadjokes/comments/idzea5/what_day_do_chickens_hate_the_most/
dadjokes,2020-08-21 23:25:16,I called my friend to tell him about my big promotion and how it comes with a lot of new responsibilities now that I m running the business  He asked what my new job was and how I was holding up ,ie4kdg,3,0,I told him  I m generally managing ,https://www.reddit.com/r/dadjokes/comments/ie4kdg/i_called_my_friend_to_tell_him_about_my_big/
dadjokes,2020-08-21 23:20:57,My wife   Someone is selling 4T clothes for 10 dollars ,ie4hfq,3,1,Me   WOW that s a lot of clothes  ,https://www.reddit.com/r/dadjokes/comments/ie4hfq/my_wife_someone_is_selling_4t_clothes_for_10/
dadjokes,2020-08-21 20:32:17,NEW NUDE WATER SKI RECORD BROKEN  ,ie18e3,4,0,It was broken by a 28 year old Russian   His name is Torehis Sackov,https://www.reddit.com/r/dadjokes/comments/ie18e3/new_nude_water_ski_record_broken/
dadjokes,2020-08-22 05:04:34,What did the forgetful bear say to his friend ,iea6ln,1,3,I can t remember     but thanks for bearing with me,https://www.reddit.com/r/dadjokes/comments/iea6ln/what_did_the_forgetful_bear_say_to_his_friend/
dadjokes,2020-08-22 05:04:30,I m absolutely terrible about leaving the toilet seat up  I admit ,iea6k9,1,0,But I probably shouldn t have married a blind woman and like to laugh so much,https://www.reddit.com/r/dadjokes/comments/iea6k9/im_absolutely_terrible_about_leaving_the_toilet/
dadjokes,2020-08-21 01:45:49,They told me a mask was enough to get into the supermarket    ,idkpxu,150,6,they lied  everybody else had their clothes on,https://www.reddit.com/r/dadjokes/comments/idkpxu/they_told_me_a_mask_was_enough_to_get_into_the/
dadjokes,2020-08-21 10:50:43,You know what really sucks ,idsk1q,28,7,Vacuum cleaners,https://www.reddit.com/r/dadjokes/comments/idsk1q/you_know_what_really_sucks/
dadjokes,2020-08-21 17:36:30,I can never tell Kylie  Kendall  and Caitlyn apart ,idxw06,6,1,I always forget which one is the trans Jenner,https://www.reddit.com/r/dadjokes/comments/idxw06/i_can_never_tell_kylie_kendall_and_caitlyn_apart/
dadjokes,2020-08-21 13:22:56,You know its raining cats and dogs   ,idu7jr,17,0,when you step in a poodle,https://www.reddit.com/r/dadjokes/comments/idu7jr/you_know_its_raining_cats_and_dogs/
dadjokes,2020-08-21 09:24:30,I was gonna post a joke about Sodium,idrke6,35,18,but then i was like Na people wouldn t get it,https://www.reddit.com/r/dadjokes/comments/idrke6/i_was_gonna_post_a_joke_about_sodium/
dadjokes,2020-08-22 04:41:01,Do you guys think if a seahorse did better in school,ie9u94,1,0,It would be an A or B horse,https://www.reddit.com/r/dadjokes/comments/ie9u94/do_you_guys_think_if_a_seahorse_did_better_in/
dadjokes,2020-08-21 02:21:59,Just farted on my wallet   ,idlcdr,127,4,Now I got gas money,https://www.reddit.com/r/dadjokes/comments/idlcdr/just_farted_on_my_wallet/
dadjokes,2020-08-21 22:29:33,why did the short person ignore the you must be this tall to ride sign,ie3i2b,3,2,he was above it,https://www.reddit.com/r/dadjokes/comments/ie3i2b/why_did_the_short_person_ignore_the_you_must_be/
dadjokes,2020-08-21 15:23:13,They said a mask would be enough to go to the supermarket    ,idvpqq,10,0,they lied  everyone else had their clothes on,https://www.reddit.com/r/dadjokes/comments/idvpqq/they_said_a_mask_would_be_enough_to_go_to_the/
dadjokes,2020-08-22 04:21:49,Just found out Trump is being run by Russia   ,ie9k21,1,2,Should have noticed the red flags earlier,https://www.reddit.com/r/dadjokes/comments/ie9k21/just_found_out_trump_is_being_run_by_russia/
dadjokes,2020-08-22 04:02:50,Why was the cow deformed ,ie99ze,0,0,Chernobull,https://www.reddit.com/r/dadjokes/comments/ie99ze/why_was_the_cow_deformed/
dadjokes,2020-08-21 22:02:56,How do you call a book where you write all of your crappy stories ,ie2zii,3,1,A diarya,https://www.reddit.com/r/dadjokes/comments/ie2zii/how_do_you_call_a_book_where_you_write_all_of/
dadjokes,2020-08-21 08:43:59,Why did the Pharaoh refuse to believe his son had drowned ,idr21f,32,2,Because he was in The Nile,https://www.reddit.com/r/dadjokes/comments/idr21f/why_did_the_pharaoh_refuse_to_believe_his_son_had/
dadjokes,2020-08-21 15:26:22,A neutron walks into a bar    ,idvrbz,11,2,and asks how  much for a drink   the bartender replies  For you no charge ,https://www.reddit.com/r/dadjokes/comments/idvrbz/a_neutron_walks_into_a_bar/
dadjokes,2020-08-21 18:36:19,What do you call an exploding DeLorean,idyz0b,4,0,A blast from the past,https://www.reddit.com/r/dadjokes/comments/idyz0b/what_do_you_call_an_exploding_delorean/
dadjokes,2020-08-21 21:10:14,I ve heard they just launched the new reptilian focused aid programme ,ie1yyq,3,0,They called it Gatorade,https://www.reddit.com/r/dadjokes/comments/ie1yyq/ive_heard_they_just_launched_the_new/
dadjokes,2020-08-21 15:03:34,I took my dog to the vet ,idvfo8,7,0,I took my Rottweiler to the vet because it s cross eyed  he lifted it up to look at it then said    I m going to have to put this dog down     What   Why   I exclaimed   Because it s cross eyed     No  because it s heavy   He replied,https://www.reddit.com/r/dadjokes/comments/idvfo8/i_took_my_dog_to_the_vet/
dadjokes,2020-08-21 14:46:40,I m done being a people pleaser,idv7pv,8,0,If everyone s okay with that,https://www.reddit.com/r/dadjokes/comments/idv7pv/im_done_being_a_people_pleaser/
dadjokes,2020-08-21 12:58:19,There was a fish who wanted to be a broadcaster,idtx1v,10,3,There was a fish who wanted to be a broadcaster  he went on air  and died,https://www.reddit.com/r/dadjokes/comments/idtx1v/there_was_a_fish_who_wanted_to_be_a_broadcaster/
dadjokes,2020-08-21 15:11:07,A consultant came in to analyse my business the other day   ,idvjgf,7,0,He said  sweeping changes had to be made    The Janitor is not happy,https://www.reddit.com/r/dadjokes/comments/idvjgf/a_consultant_came_in_to_analyse_my_business_the/
dadjokes,2020-08-21 19:34:36,Starbucks is missing out on a huge business opportunity by NOT selling masks that you can drink through ,ie03nl,5,0,They could call them coughy filters,https://www.reddit.com/r/dadjokes/comments/ie03nl/starbucks_is_missing_out_on_a_huge_business/
dadjokes,2020-08-21 04:36:53,Marxist jokes aren t funny    ,idnhy6,48,0,Unless everyone gets them,https://www.reddit.com/r/dadjokes/comments/idnhy6/marxist_jokes_arent_funny/
dadjokes,2020-08-21 17:19:18,The Russian president is insane,idxkus,5,0,He must be putin jail,https://www.reddit.com/r/dadjokes/comments/idxkus/the_russian_president_is_insane/
dadjokes,2020-08-21 18:49:36,Did you hear about the cat who ate a ball of yarn ,idz7y7,3,1,She had a litter of mittens,https://www.reddit.com/r/dadjokes/comments/idz7y7/did_you_hear_about_the_cat_who_ate_a_ball_of_yarn/
dadjokes,2020-08-21 07:30:51,Doctor  I feel like a pair of curtains,idq3rg,23,1,Doctor  Then pull yourself together,https://www.reddit.com/r/dadjokes/comments/idq3rg/doctor_i_feel_like_a_pair_of_curtains/
dadjokes,2020-08-22 00:31:19,Why did the racer lose the race in Finland ,ie5sdt,1,0,He finnished last,https://www.reddit.com/r/dadjokes/comments/ie5sdt/why_did_the_racer_lose_the_race_in_finland/
dadjokes,2020-08-21 14:46:46,I used to work in a shoe recycling shop  ,idv7r6,5,1,  It was sole destroying,https://www.reddit.com/r/dadjokes/comments/idv7r6/i_used_to_work_in_a_shoe_recycling_shop/
dadjokes,2020-08-20 23:07:22,Before the invention of the wheel   ,idhs8p,110,6,   everything was a drag,https://www.reddit.com/r/dadjokes/comments/idhs8p/before_the_invention_of_the_wheel/
dadjokes,2020-08-21 07:05:57,I was thrown out of the local park for arranging the squirrels by height   ,idpqxz,24,0,Apparently they just can t take a little critter sizing,https://www.reddit.com/r/dadjokes/comments/idpqxz/i_was_thrown_out_of_the_local_park_for_arranging/
dadjokes,2020-08-21 05:12:15,I think it was a mistake to call childbirth  delivery  ,ido23f,36,5,It should have been called takeout instead,https://www.reddit.com/r/dadjokes/comments/ido23f/i_think_it_was_a_mistake_to_call_childbirth/
dadjokes,2020-08-21 20:25:29,How do you greet a rapper who barks ,ie13r4,2,2,What s up dowg,https://www.reddit.com/r/dadjokes/comments/ie13r4/how_do_you_greet_a_rapper_who_barks/
dadjokes,2020-08-21 10:07:23,So a wookie made me some steak,ids2mb,11,0,its  good but it came out a little Chewie,https://www.reddit.com/r/dadjokes/comments/ids2mb/so_a_wookie_made_me_some_steak/
dadjokes,2020-08-21 19:10:47,If 6 was afraid of 7 bc it ate 9  why was 10 scared ,idzmvr,1,1,Bc it was in the middle on 9 11,https://www.reddit.com/r/dadjokes/comments/idzmvr/if_6_was_afraid_of_7_bc_it_ate_9_why_was_10_scared/
dadjokes,2020-08-21 16:36:48,i got a prison sentence,idwus4,3,3,i don t remember what it said,https://www.reddit.com/r/dadjokes/comments/idwus4/i_got_a_prison_sentence/
dadjokes,2020-08-22 04:21:23,There s no ants at the poles because,ie9ju3,0,0,Ant  Arctic  Uh,https://www.reddit.com/r/dadjokes/comments/ie9ju3/theres_no_ants_at_the_poles_because/
dadjokes,2020-08-21 12:24:23,Why the handyman couldn t be trusted to hang some pictures ,idtjnv,7,0,He kept screwing everything,https://www.reddit.com/r/dadjokes/comments/idtjnv/why_the_handyman_couldnt_be_trusted_to_hang_some/
dadjokes,2020-08-21 15:55:06,Two Irishmen are sitting outside and a truck carrying turf drives past ,idw6gp,3,0, I d like to be that rich one day   Says Billy    What  buy new turf   Asks Shamus    No  send my grass away to be mowed   Replies Billy,https://www.reddit.com/r/dadjokes/comments/idw6gp/two_irishmen_are_sitting_outside_and_a_truck/
dadjokes,2020-08-21 14:12:26,What s the best time to go to the dentist ,idusx2,5,1,2 30,https://www.reddit.com/r/dadjokes/comments/idusx2/whats_the_best_time_to_go_to_the_dentist/
dadjokes,2020-08-22 03:32:08,What goes Clickety Click,ie8tm6,0,1,What goes clickety click have I done it yet   A blind man doing the rubiks cube    x200B   What goes ha ha bonk  somebody laughing their head off,https://www.reddit.com/r/dadjokes/comments/ie8tm6/what_goes_clickety_click/
dadjokes,2020-08-19 20:50:49,Prediction  There will be a minor Baby Boom in 9 months  and then one day in 2033 we will witness the rise of,icsl5n,25876,512,The Quaranteens,https://www.reddit.com/r/dadjokes/comments/icsl5n/prediction_there_will_be_a_minor_baby_boom_in_9/
dadjokes,2020-08-21 17:25:33,Guess what creatures can add 8 3 14159,idxozx,2,1,OctoPi,https://www.reddit.com/r/dadjokes/comments/idxozx/guess_what_creatures_can_add_8314159/
dadjokes,2020-08-21 21:02:54,A bear arrives at the door of a house not knowing that dad in this house has decided to get drunk tonight and he is really possessive about his alcohol  While he passes through the door to reach to the fridge  he sees the bear standing outside the glass door and stands still out of fear ,ie1tqg,0,0,Wife  upon seeing dad going to the fridge  shouts from the common room    if you have a beer  open it for me        We all know what happens next,https://www.reddit.com/r/dadjokes/comments/ie1tqg/a_bear_arrives_at_the_door_of_a_house_not_knowing/
dadjokes,2020-08-21 21:01:29,If Bieber was a breaking news reporter  how would he interrupt a broadcast to report breaking news ,ie1squ,1,0, This Justin ,https://www.reddit.com/r/dadjokes/comments/ie1squ/if_bieber_was_a_breaking_news_reporter_how_would/
dadjokes,2020-08-21 13:14:07,I was examining a lad s driving test ,idu3pa,4,1,At the end  he stopped us outside the test centre    You know   I began   alcohol really impairs someone s judgements      The lad s lip quivered   But I m not drunk  mister     No   I replied   I am  and you ve passed  ,https://www.reddit.com/r/dadjokes/comments/idu3pa/i_was_examining_a_lads_driving_test/
dadjokes,2020-08-20 13:07:03,The last thing my grandfather said to me before he died was  Pints  Gallons  Litres  ,id7jyn,347,22,That spoke volumes,https://www.reddit.com/r/dadjokes/comments/id7jyn/the_last_thing_my_grandfather_said_to_me_before/
dadjokes,2020-08-21 16:56:58,My wife keeps trying to make me wear diapers,idx6q7,2,1,She s got to be kid ding me,https://www.reddit.com/r/dadjokes/comments/idx6q7/my_wife_keeps_trying_to_make_me_wear_diapers/
dadjokes,2020-08-22 06:26:05,Girlfriends daughter was eating watermelon spreading a lot of salt on it ,iebc3b,0,0,Mom and I go wooh that s enough    She looks at us and goes what   I was just assaulted   ,https://www.reddit.com/r/dadjokes/comments/iebc3b/girlfriends_daughter_was_eating_watermelon/
dadjokes,2020-08-20 16:32:59,I just found out that Bill Nye is just a stage name ,idacrk,173,22,His real name is William New Year s Eve,https://www.reddit.com/r/dadjokes/comments/idacrk/i_just_found_out_that_bill_nye_is_just_a_stage/
dadjokes,2020-08-21 20:29:31,The man who invented windowsills,ie16fk,1,0,What a ledge,https://www.reddit.com/r/dadjokes/comments/ie16fk/the_man_who_invented_windowsills/
dadjokes,2020-08-21 10:38:20,Today I saw a guy with albinism fall down so I asked him if he was okay ,idsfas,5,0,He told me he was all white,https://www.reddit.com/r/dadjokes/comments/idsfas/today_i_saw_a_guy_with_albinism_fall_down_so_i/
dadjokes,2020-08-21 01:59:40,My 13 year old told me he has an ant bite ,idkyi2,29,2,I asked if he has an Uncle Chew  He hasn t acknowledged me in half an hour  I can t stop laughing,https://www.reddit.com/r/dadjokes/comments/idkyi2/my_13yearold_told_me_he_has_an_ant_bite/
dadjokes,2020-08-22 04:47:40,So there s two guys  Ed and Chris  They manage to kidnap some girl and hold her for ransom  Ed doesn t do a very good job tying her up though  so when Chris goes back  he makes a shocking discovery ,ie9xu0,0,0, Ed  Ed  the girl is gone     What     Ed  she ran      ,https://www.reddit.com/r/dadjokes/comments/ie9xu0/so_theres_two_guys_ed_and_chris_they_manage_to/
