subreddit_topic,subreddit_time_created,subreddit_title,subreddit_id,subreddit_score,subreddit_num_comments,subreddit_body,subreddit_url
dadjokes,2020-08-24 17:56:26, NSFW  Strippers don t have air conditioning in their house,ifqj84,2302,24,Onlyfans,https://www.reddit.com/r/dadjokes/comments/ifqj84/nsfw_strippers_dont_have_air_conditioning_in/
dadjokes,2020-08-24 02:00:15,My friend told me   Your wife and daughter look like twins  ,ifdb78,22215,140,I said   Well  they were separated at birth  ,https://www.reddit.com/r/dadjokes/comments/ifdb78/my_friend_told_me_your_wife_and_daughter_look/
dadjokes,2020-08-24 13:05:48,What do you call a 60 year old flying in a jet  fighter ,ifm7ia,363,11,A sonic boomer,https://www.reddit.com/r/dadjokes/comments/ifm7ia/what_do_you_call_a_60year_old_flying_in_a_jet/
dadjokes,2020-08-24 16:13:04,It wasn t much fun when I broke my neck in an accident a few months ago ,ifopo5,90,4,But now I can look back and laugh,https://www.reddit.com/r/dadjokes/comments/ifopo5/it_wasnt_much_fun_when_i_broke_my_neck_in_an/
dadjokes,2020-08-24 19:36:04,Someone stole my friend David s ID,ifsfe6,50,4,So now he s just Dav,https://www.reddit.com/r/dadjokes/comments/ifsfe6/someone_stole_my_friend_davids_id/
dadjokes,2020-08-24 19:59:28,Confusing Venus with Aphrodite is no big deal ,ifswxo,41,2,It s just a mythunderstanding,https://www.reddit.com/r/dadjokes/comments/ifswxo/confusing_venus_with_aphrodite_is_no_big_deal/
dadjokes,2020-08-24 20:46:48,My wife asked me if she could have some peace and quiet while she tried to cook dinner,iftv0y,23,1,So I took the batteries out of the smoke alarm,https://www.reddit.com/r/dadjokes/comments/iftv0y/my_wife_asked_me_if_she_could_have_some_peace_and/
dadjokes,2020-08-24 15:11:57,I was cleaning my finger gun the other day   ,ifns1r,43,1,And shot a hole in my air guitar,https://www.reddit.com/r/dadjokes/comments/ifns1r/i_was_cleaning_my_finger_gun_the_other_day/
dadjokes,2020-08-23 13:12:16,I often worry about German sausages,if0sik,10949,103,Basically I fear the wurst    Edit  thanks for my first award ya loonies   ,https://www.reddit.com/r/dadjokes/comments/if0sik/i_often_worry_about_german_sausages/
dadjokes,2020-08-24 04:46:46,Did you hear about the wisdom tooth who got smart with the dentist ,iffxtc,277,15, removed ,https://www.reddit.com/r/dadjokes/comments/iffxtc/did_you_hear_about_the_wisdom_tooth_who_got_smart/
dadjokes,2020-08-24 14:30:04,How do you spot a blind man at a nudist colony ,ifn7ok,43,5,It s not hard,https://www.reddit.com/r/dadjokes/comments/ifn7ok/how_do_you_spot_a_blind_man_at_a_nudist_colony/
dadjokes,2020-08-24 17:08:12,Hey Dad did you get a haircut ,ifpns4,25,5,No son  I got them all cut,https://www.reddit.com/r/dadjokes/comments/ifpns4/hey_dad_did_you_get_a_haircut/
dadjokes,2020-08-24 14:47:16,Just what is it about all the Psychics that I visit  they re either totally depressed or too excitable  ,ifnftw,29,2,  it s really hard to find the happy Medium,https://www.reddit.com/r/dadjokes/comments/ifnftw/just_what_is_it_about_all_the_psychics_that_i/
dadjokes,2020-08-24 14:35:31,Somebody drilled a hole in the fence around the nudist colony,ifnaa0,31,2,Authorities are looking into it,https://www.reddit.com/r/dadjokes/comments/ifnaa0/somebody_drilled_a_hole_in_the_fence_around_the/
dadjokes,2020-08-23 16:28:33,Bilbo Baggins wakes up suddenly to  Don t stop Believing  ,if36nm,1989,28,It was an unexpected Journey,https://www.reddit.com/r/dadjokes/comments/if36nm/bilbo_baggins_wakes_up_suddenly_to_dont_stop/
dadjokes,2020-08-23 21:23:29,Why do cows have hooves ,if8a39,678,11,Because they lactose,https://www.reddit.com/r/dadjokes/comments/if8a39/why_do_cows_have_hooves/
dadjokes,2020-08-24 03:45:17,What happens when you eat 3 14 slices of pizza ,ifezwd,189,13,You get really full   What  were you expecting a pie joke on my cake day,https://www.reddit.com/r/dadjokes/comments/ifezwd/what_happens_when_you_eat_314_slices_of_pizza/
dadjokes,2020-08-24 20:02:31,Where did the father store all his information ,ifsz8f,10,0,In the Dada base,https://www.reddit.com/r/dadjokes/comments/ifsz8f/where_did_the_father_store_all_his_information/
dadjokes,2020-08-24 20:35:25, My greatest fear is dying alone   I said,iftmou,8,1, That s kind of a dumb fear   My conjoined twin said,https://www.reddit.com/r/dadjokes/comments/iftmou/my_greatest_fear_is_dying_alone_i_said/
dadjokes,2020-08-24 15:16:00,My wife celebrated her two year anniversary of getting a breast reduction,ifnu3a,21,2,She asked if I ever miss them  I always tell her it was her choice not mine and that the mammaries will last forever,https://www.reddit.com/r/dadjokes/comments/ifnu3a/my_wife_celebrated_her_two_year_anniversary_of/
dadjokes,2020-08-24 06:06:17,Strippers don t have ACs in their homes,ifh5tj,108,12,Onlyfans,https://www.reddit.com/r/dadjokes/comments/ifh5tj/strippers_dont_have_acs_in_their_homes/
dadjokes,2020-08-24 20:45:10,When I was in college my roommate used to clean my room and I used to clean his,ifttw6,6,0,We were maid for each other,https://www.reddit.com/r/dadjokes/comments/ifttw6/when_i_was_in_college_my_roommate_used_to_clean/
dadjokes,2020-08-24 19:49:56,Why can fruit not get married at city hall ,ifspwi,6,0,Because they cantaloupe,https://www.reddit.com/r/dadjokes/comments/ifspwi/why_can_fruit_not_get_married_at_city_hall/
dadjokes,2020-08-24 21:43:40,I used to have addictive issues with Swimming  but now I m proud to say  ,ifv0ji,4,0,   that I m dry for the last four years,https://www.reddit.com/r/dadjokes/comments/ifv0ji/i_used_to_have_addictive_issues_with_swimming_but/
dadjokes,2020-08-24 09:51:49,What do you call a killing before yoga practice ,ifk3f8,34,2,A pre meditated murder,https://www.reddit.com/r/dadjokes/comments/ifk3f8/what_do_you_call_a_killing_before_yoga_practice/
dadjokes,2020-08-24 19:24:09,My doctor bit my neck and tried to give me a hickey ,ifs79h,6,1,1 star review for Dr  Acula,https://www.reddit.com/r/dadjokes/comments/ifs79h/my_doctor_bit_my_neck_and_tried_to_give_me_a/
dadjokes,2020-08-24 17:10:08,Looking at a Terminix truck  the IX at the end are the roman numerals for the number nine   ,ifpp1d,9,1,Which is one more than eight  I feel this has to have been part of the name creation   We ll do you one better than terminate  we ll termiNINE ,https://www.reddit.com/r/dadjokes/comments/ifpp1d/looking_at_a_terminix_truck_the_ix_at_the_end_are/
dadjokes,2020-08-24 02:45:16,My mute son and I got into a fight today,ife1hh,109,4,We re not on speaking terms,https://www.reddit.com/r/dadjokes/comments/ife1hh/my_mute_son_and_i_got_into_a_fight_today/
dadjokes,2020-08-24 22:05:37,What did the mathematician say when 90 became 1 ,ifvg9u,3,1, Oh god I have SINned ,https://www.reddit.com/r/dadjokes/comments/ifvg9u/what_did_the_mathematician_say_when_90_became_1/
dadjokes,2020-08-23 23:34:08,A guy walks into a bar and orders a Corona and two hurricanes,ifap21,184,12,The bartender says   that ll be  20 20 ,https://www.reddit.com/r/dadjokes/comments/ifap21/a_guy_walks_into_a_bar_and_orders_a_corona_and/
dadjokes,2020-08-24 19:07:38,You never want to challenge an extreme dieter to a footrace   ,ifrw6g,5,2,Cuz they fast,https://www.reddit.com/r/dadjokes/comments/ifrw6g/you_never_want_to_challenge_an_extreme_dieter_to/
dadjokes,2020-08-24 19:06:23,What was the vacuum s first name ,ifrvah,6,1,Erin,https://www.reddit.com/r/dadjokes/comments/ifrvah/what_was_the_vacuums_first_name/
dadjokes,2020-08-24 17:16:27,What kind of crows always stick together   ,ifpt5j,6,2,Velcrowes,https://www.reddit.com/r/dadjokes/comments/ifpt5j/what_kind_of_crows_always_stick_together/
dadjokes,2020-08-24 21:37:24,What is the favourite sport of the ten legged spider ,ifuvza,3,2,Tennis,https://www.reddit.com/r/dadjokes/comments/ifuvza/what_is_the_favourite_sport_of_the_ten_legged/
dadjokes,2020-08-24 21:35:29,I lost my watch at a party once  turns out there was a guy harassing a woman while stepping on my watch  I went over to him a punched him  saying   No one does that to a woman   ,ifuul7,3,0,not on my watch ,https://www.reddit.com/r/dadjokes/comments/ifuul7/i_lost_my_watch_at_a_party_once_turns_out_there/
dadjokes,2020-08-24 21:30:31,Is this shirt felt ,ifur0f,3,0, touch shirt   It is now,https://www.reddit.com/r/dadjokes/comments/ifur0f/is_this_shirt_felt/
dadjokes,2020-08-24 12:14:58,Why do cows have hoofs instead of feet ,iflnlh,16,0,Because they lactose,https://www.reddit.com/r/dadjokes/comments/iflnlh/why_do_cows_have_hoofs_instead_of_feet/
dadjokes,2020-08-24 18:49:34,Q  What do you call four bullfighters in quicksand ,ifrjdq,3,1,A  Cuatro Sinko,https://www.reddit.com/r/dadjokes/comments/ifrjdq/q_what_do_you_call_four_bullfighters_in_quicksand/
dadjokes,2020-08-24 07:42:48,If someone says Tequila is good for you,ifiiwd,27,0,Take it with a pinch of salt,https://www.reddit.com/r/dadjokes/comments/ifiiwd/if_someone_says_tequila_is_good_for_you/
dadjokes,2020-08-24 10:08:33,A dwarf psychic robbed a bank today ,ifka1x,18,2,The news reported that there s a small medium at large,https://www.reddit.com/r/dadjokes/comments/ifka1x/a_dwarf_psychic_robbed_a_bank_today/
dadjokes,2020-08-24 13:19:14,I ll never forget when my dad told me   Find yourself a girl with an embarrassing tattoo and try to convince her to marry you   A little taken aback  I asked him what he meant  He explained   ,ifmd3q,11,0,   She knows how to make bad decisions and stick by them  ,https://www.reddit.com/r/dadjokes/comments/ifmd3q/ill_never_forget_when_my_dad_told_me_find/
dadjokes,2020-08-24 12:30:36,What do you call it when a Norse god is scared of something ,ifltd3,12,0,They re aFreyed,https://www.reddit.com/r/dadjokes/comments/ifltd3/what_do_you_call_it_when_a_norse_god_is_scared_of/
dadjokes,2020-08-24 14:14:19,YouTube  Twitter and Facebook are merging   ,ifn0mq,7,2,They ll henceforth be known as YouTwitFace,https://www.reddit.com/r/dadjokes/comments/ifn0mq/youtube_twitter_and_facebook_are_merging/
dadjokes,2020-08-24 17:56:55,We were having so much bad luck on our cul de sac that the HOA thought we had been cursed  They brought in a witch doctor and druid to scribe protective symbols and runes all over the road   ,ifqjif,4,0,   well  that s the ward on the street anyway,https://www.reddit.com/r/dadjokes/comments/ifqjif/we_were_having_so_much_bad_luck_on_our_culdesac/
dadjokes,2020-08-23 17:35:07,A boy knocks his father down the stairs in a freak accident ,if47q6,320,8,The father breaks his neck and dies  leaving his son to mourn for days  However  one night  the boy wakes up to see an apparition of his father before him  All at once  he breaks down crying  and screams out   I m sorry    His father responds   Hi Sorry  I m dead  ,https://www.reddit.com/r/dadjokes/comments/if47q6/a_boy_knocks_his_father_down_the_stairs_in_a/
dadjokes,2020-08-24 16:03:09,I know a religious woman living in a monastery who studies the encyclopedia   ,ifojlc,7,0,She s nun the wiser,https://www.reddit.com/r/dadjokes/comments/ifojlc/i_know_a_religious_woman_living_in_a_monastery/
dadjokes,2020-08-24 11:41:54,My abacus is so reliable ,iflaz2,13,0,I can always count on it,https://www.reddit.com/r/dadjokes/comments/iflaz2/my_abacus_is_so_reliable/
dadjokes,2020-08-24 17:07:08,A man lost his tongue in an accident  He was most upset that he could no longer enjoy his food  so he searched for a surgeon that would do a transplant  Finally he found an organ doner and paid  25k for the procedure   ,ifpn2s,6,0,    later  he had to admit that the new tongue wasn t the same as before  but still it was an acquired taste,https://www.reddit.com/r/dadjokes/comments/ifpn2s/a_man_lost_his_tongue_in_an_accident_he_was_most/
dadjokes,2020-08-24 14:00:44,There was a man that wasn t allowed to fart ,ifmul2,8,0,Since he started dating  his girlfriend would chastise him to great lengths everytime he felt the need to fart   After they got married  the situation was maintained  He couldn t possibly fart near his wife  Sometimes he had to leave the house  just to pass some gas   When he was really old  he died peacefully during in his sleep while lying on his back  She called the undertaker  so the arrangements for the funeral could be made   When the undertaker rolled the man of the bed  there was a massive fart  The undertaker looked to the now widow to see how she was going to react  but she simply said    No need to chastise him anymore  Hee can RIP in Peace  ,https://www.reddit.com/r/dadjokes/comments/ifmul2/there_was_a_man_that_wasnt_allowed_to_fart/
dadjokes,2020-08-24 13:54:14,The butcher kept getting my order wrong  He gave me a porterhouse instead of a filet mignon ,ifmrwm,7,10,He said it was a mis steak,https://www.reddit.com/r/dadjokes/comments/ifmrwm/the_butcher_kept_getting_my_order_wrong_he_gave/
dadjokes,2020-08-24 09:44:53,You think musical wizards are weird ,ifk0pf,16,3,Imagine dragons,https://www.reddit.com/r/dadjokes/comments/ifk0pf/you_think_musical_wizards_are_weird/
dadjokes,2020-08-23 22:41:14,I ve got racing geese for sale,if9puk,111,2,Let me know if you want to take a quick gander,https://www.reddit.com/r/dadjokes/comments/if9puk/ive_got_racing_geese_for_sale/
dadjokes,2020-08-24 13:30:59,A wonderful bird  the pelican ,ifmi2u,7,1,His beak can hold more than his bellycan,https://www.reddit.com/r/dadjokes/comments/ifmi2u/a_wonderful_bird_the_pelican/
dadjokes,2020-08-23 18:48:24,As a short guy  I was completely sure there was nothing to be done about my height  I went to the doctor  turns out I had scoliosis ,if5gec,217,10,I stand corrected,https://www.reddit.com/r/dadjokes/comments/if5gec/as_a_short_guy_i_was_completely_sure_there_was/
dadjokes,2020-08-23 23:23:23,My wife caught me standing on the bathroom scale  sucking in my stomach ,ifahvh,94,2,Ha  That s not going to help  she said  Sure  it does  I said  Its the only way I can see the numbers,https://www.reddit.com/r/dadjokes/comments/ifahvh/my_wife_caught_me_standing_on_the_bathroom_scale/
dadjokes,2020-08-24 14:58:58,What is the opposite of  always won t take them down  ,ifnl6j,3,2,Never gonna give you up,https://www.reddit.com/r/dadjokes/comments/ifnl6j/what_is_the_opposite_of_always_wont_take_them_down/
dadjokes,2020-08-24 10:29:22,I hope this rain keeps up ,ifkiex,11,0,That way it won t come down,https://www.reddit.com/r/dadjokes/comments/ifkiex/i_hope_this_rain_keeps_up/
dadjokes,2020-08-24 19:38:30,Who makes the best musical range cookers ,ifsh5q,2,1,Aga do,https://www.reddit.com/r/dadjokes/comments/ifsh5q/who_makes_the_best_musical_range_cookers/
dadjokes,2020-08-24 02:57:21,I just bought a dog from the blacksmith,ife8bm,41,0,As soon as he got home he made a bolt for the door     Thought this fit here  Saw it on r jokes from u jimathay,https://www.reddit.com/r/dadjokes/comments/ife8bm/i_just_bought_a_dog_from_the_blacksmith/
dadjokes,2020-08-24 15:44:42,The opposite of the opposite of wrong is not wrong   ,ifo928,3,2,it is left,https://www.reddit.com/r/dadjokes/comments/ifo928/the_opposite_of_the_opposite_of_wrong_is_not_wrong/
dadjokes,2020-08-24 19:21:48,A hole was discovered in the fence surrounding the local nudist colony,ifs5hr,2,0,Authorities are looking into it,https://www.reddit.com/r/dadjokes/comments/ifs5hr/a_hole_was_discovered_in_the_fence_surrounding/
dadjokes,2020-08-24 19:18:13,Where does a nun buy her cowl ,ifs33o,2,0,At the Habit ashery,https://www.reddit.com/r/dadjokes/comments/ifs33o/where_does_a_nun_buy_her_cowl/
dadjokes,2020-08-23 03:59:09,My friend went bald years ago  but still carries his old comb with him ,ieu7k2,3340,35,He just can t part with it,https://www.reddit.com/r/dadjokes/comments/ieu7k2/my_friend_went_bald_years_ago_but_still_carries/
dadjokes,2020-08-22 23:35:52,If you rearrange the letters of MAILMEN,iepxw2,14749,155,They get really upset,https://www.reddit.com/r/dadjokes/comments/iepxw2/if_you_rearrange_the_letters_of_mailmen/
dadjokes,2020-08-24 18:34:04,Today my sheep did me a favor ,ifr8mn,2,0,So I said  Thank ewe  ,https://www.reddit.com/r/dadjokes/comments/ifr8mn/today_my_sheep_did_me_a_favor/
dadjokes,2020-08-24 09:39:07,Do you know what one shepherd said to the other shepherd ,ifjya5,10,2,Let s get the flock out of here,https://www.reddit.com/r/dadjokes/comments/ifjya5/do_you_know_what_one_shepherd_said_to_the_other/
dadjokes,2020-08-24 22:03:57,A squid seaman cried helplessly ,ifvf1w,1,0, I ve lost my ten tackles  ,https://www.reddit.com/r/dadjokes/comments/ifvf1w/a_squid_seaman_cried_helplessly/
dadjokes,2020-08-24 10:04:25,I stand corrected,ifk8e6,10,1,Said the man in the orthopaedic shoes,https://www.reddit.com/r/dadjokes/comments/ifk8e6/i_stand_corrected/
dadjokes,2020-08-24 21:40:40,A friend of mine took me to a Japanese liquor store   ,ifuyac,1,0,I wasn t all that impressed  it s just Plum Wine,https://www.reddit.com/r/dadjokes/comments/ifuyac/a_friend_of_mine_took_me_to_a_japanese_liquor/
dadjokes,2020-08-24 15:37:06,Beauty Products,ifo4ty,3,0,A local news organization reported on a group of protesters outside a beauty supply store  When asked what they were protesting  one of the people replied   For too long has this store peddled fake products  We demand they stop selling shampoo and start selling real poo  ,https://www.reddit.com/r/dadjokes/comments/ifo4ty/beauty_products/
dadjokes,2020-08-24 07:58:38,Child  can you tell me what a solar eclipse is ,ifiq2x,12,1,Dad  no sun,https://www.reddit.com/r/dadjokes/comments/ifiq2x/child_can_you_tell_me_what_a_solar_eclipse_is/
dadjokes,2020-08-24 09:59:33,Just witnessed a tragic car accident where a man lost his entire left side   ,ifk6eu,8,1,He s all right now,https://www.reddit.com/r/dadjokes/comments/ifk6eu/just_witnessed_a_tragic_car_accident_where_a_man/
dadjokes,2020-08-24 15:17:24,Why are horses bad at group votes ,ifnutv,3,0,Because they always say neigh,https://www.reddit.com/r/dadjokes/comments/ifnutv/why_are_horses_bad_at_group_votes/
dadjokes,2020-08-24 02:52:08,When I came home today my wife had some Little Debbie Zerbra Cakes on the counter  I pick one up and say  A Zebra Cake  ,ife5fw,28,3, Don t mind if I Zoo    She just gave me a glare and went back to what she was doing   Totally worth it,https://www.reddit.com/r/dadjokes/comments/ife5fw/when_i_came_home_today_my_wife_had_some_little/
dadjokes,2020-08-24 20:50:08,What should you do when you are unsure whether it will rain or not  ,iftxgk,1,0,Well  carry an Ummm  brella,https://www.reddit.com/r/dadjokes/comments/iftxgk/what_should_you_do_when_you_are_unsure_whether_it/
dadjokes,2020-08-24 20:12:59,I had my first dream where everyone was wearing masks   ,ift6q2,1,0,    unfortunately they were robbing my bank,https://www.reddit.com/r/dadjokes/comments/ift6q2/i_had_my_first_dream_where_everyone_was_wearing/
dadjokes,2020-08-24 14:13:05,There are plans to turn Kodak into a pharmaceutical company,ifn023,3,1,But the plans are underdeveloped,https://www.reddit.com/r/dadjokes/comments/ifn023/there_are_plans_to_turn_kodak_into_a/
dadjokes,2020-08-24 14:06:04,What do you call a cow with two legs ,ifmx10,5,3,Lean beef,https://www.reddit.com/r/dadjokes/comments/ifmx10/what_do_you_call_a_cow_with_two_legs/
dadjokes,2020-08-23 05:16:50,Which lawn decorations move around from yard to yard ,ievb3i,1303,19,Gnomads     x200B    I m not a dad but I came up with this one last year and have been dying to share it  ,https://www.reddit.com/r/dadjokes/comments/ievb3i/which_lawn_decorations_move_around_from_yard_to/
dadjokes,2020-08-24 01:37:45,A man walks into a bar  orders Corona and 2 hurricanes,ifcxub,26,10,Bartenders says   That ll be  20 20 ,https://www.reddit.com/r/dadjokes/comments/ifcxub/a_man_walks_into_a_bar_orders_corona_and_2/
dadjokes,2020-08-24 05:33:04,I sat next to a guy that looked identical to me ,ifgnbd,13,2,I was beside myself,https://www.reddit.com/r/dadjokes/comments/ifgnbd/i_sat_next_to_a_guy_that_looked_identical_to_me/
dadjokes,2020-08-23 23:34:56,My wife said that our relationship is like a holiday ,ifapjs,44,3,No  wait  that s not it  She said it was her last resort,https://www.reddit.com/r/dadjokes/comments/ifapjs/my_wife_said_that_our_relationship_is_like_a/
dadjokes,2020-08-24 12:08:56,What did the burrito topping with a good workflow say ,ifllec,6,0,I m on a roll,https://www.reddit.com/r/dadjokes/comments/ifllec/what_did_the_burrito_topping_with_a_good_workflow/
dadjokes,2020-08-24 07:44:29,What do you call a fish with no eyes ,ifijrb,8,0,Fsh,https://www.reddit.com/r/dadjokes/comments/ifijrb/what_do_you_call_a_fish_with_no_eyes/
dadjokes,2020-08-24 09:53:54,When i heared that they removed Trump from the white house after realizing he probably wasn t the right man for the job  ,ifk4b5,5,3,  all i could do was shake my head and mumble     Unpresidented ,https://www.reddit.com/r/dadjokes/comments/ifk4b5/when_i_heared_that_they_removed_trump_from_the/
dadjokes,2020-08-23 11:42:36,I ve got this awful disease where I can t stop telling airport jokes,iezvc5,353,16,My doctor says it terminal,https://www.reddit.com/r/dadjokes/comments/iezvc5/ive_got_this_awful_disease_where_i_cant_stop/
dadjokes,2020-08-24 19:26:22,What kind of bed does the Prince of Whales sleep on ,ifs8rq,1,1,An heir mattress,https://www.reddit.com/r/dadjokes/comments/ifs8rq/what_kind_of_bed_does_the_prince_of_whales_sleep/
dadjokes,2020-08-23 23:16:42,What did 50 cent do when he got hungry ,ifadj8,37,4,58,https://www.reddit.com/r/dadjokes/comments/ifadj8/what_did_50_cent_do_when_he_got_hungry/
dadjokes,2020-08-24 04:43:54,Ever heard the one about procrastination ,iffw9i,14,2,I ll tell you later,https://www.reddit.com/r/dadjokes/comments/iffw9i/ever_heard_the_one_about_procrastination/
dadjokes,2020-08-24 08:27:46,I recently joined a nudist colony ,ifj3q4,7,4, The first week was the hardest,https://www.reddit.com/r/dadjokes/comments/ifj3q4/i_recently_joined_a_nudist_colony/
dadjokes,2020-08-24 04:13:14,Dreamed I was a muffler last night   ,ifffhd,15,1,I woke up exhausted,https://www.reddit.com/r/dadjokes/comments/ifffhd/dreamed_i_was_a_muffler_last_night/
dadjokes,2020-08-24 02:00:12,Where do you take someone who has been the victim of a Peek a boo accident ,ifdb5m,21,4,The I C U,https://www.reddit.com/r/dadjokes/comments/ifdb5m/where_do_you_take_someone_who_has_been_the_victim/
dadjokes,2020-08-24 07:59:12,My son told me he had never used a telescope before   ,ifiqb0,8,1,I told him he should look into it,https://www.reddit.com/r/dadjokes/comments/ifiqb0/my_son_told_me_he_had_never_used_a_telescope/
dadjokes,2020-08-24 12:34:52,What do you call a hoard of a million Latin speaking gigantic sharks ,iflv4u,3,0,MegaLodon,https://www.reddit.com/r/dadjokes/comments/iflv4u/what_do_you_call_a_hoard_of_a_million/
dadjokes,2020-08-24 04:10:34,Why do people always make you to sit down before they tell you bad news ,iffe1b,13,2,Because they know that you won t stand for it,https://www.reddit.com/r/dadjokes/comments/iffe1b/why_do_people_always_make_you_to_sit_down_before/
dadjokes,2020-08-24 03:19:05,What do you call a Chinese man who has lost his sense of direction ,ifekzb,15,7,Wong Wei,https://www.reddit.com/r/dadjokes/comments/ifekzb/what_do_you_call_a_chinese_man_who_has_lost_his/
dadjokes,2020-08-24 11:47:05,How do you surprise a pokémon ,ifld1c,5,0, Pika boo  ,https://www.reddit.com/r/dadjokes/comments/ifld1c/how_do_you_surprise_a_pokémon/
dadjokes,2020-08-24 17:43:30,I asked my wife if I could throw something away and she said  No  it goes it the felt bag  ,ifqaun,0,0, Good  cause I d have felt pretty bag if I had to throw this away ,https://www.reddit.com/r/dadjokes/comments/ifqaun/i_asked_my_wife_if_i_could_throw_something_away/
dadjokes,2020-08-24 01:52:29,Did any of you hear the rumor about butter  ,ifd6ox,18,3,Never mind  I shouldn t spread it  You know  my mom doesn t like when I tell jokes about butter but    ah heck  I m already on a roll,https://www.reddit.com/r/dadjokes/comments/ifd6ox/did_any_of_you_hear_the_rumor_about_butter/
dadjokes,2020-08-24 01:25:31,To be or not to be a horse rider,ifcqgj,18,0,That is equestrian,https://www.reddit.com/r/dadjokes/comments/ifcqgj/to_be_or_not_to_be_a_horse_rider/
dadjokes,2020-08-24 03:37:56,What is a gallon of milk s weak spot ,ifevn7,12,1,The jugular,https://www.reddit.com/r/dadjokes/comments/ifevn7/what_is_a_gallon_of_milks_weak_spot/
dadjokes,2020-08-24 05:06:45,What happened to the magician who was driving down the street ,ifg8w2,10,1,He turned into a driveway,https://www.reddit.com/r/dadjokes/comments/ifg8w2/what_happened_to_the_magician_who_was_driving/
dadjokes,2020-08-23 21:07:25,Batman   I am vengeance,if7yzg,41,7,His Father   Hi vengeance  I am dead,https://www.reddit.com/r/dadjokes/comments/if7yzg/batman_i_am_vengeance/
dadjokes,2020-08-24 01:56:40,Did you hear about the guy who dipped his balls in glitter ,ifd92l,16,2,Pretty nuts am I right,https://www.reddit.com/r/dadjokes/comments/ifd92l/did_you_hear_about_the_guy_who_dipped_his_balls/
dadjokes,2020-08-24 03:39:01,Hey my first joke here is about Patella injuries,ifew9x,13,0,It s a real knee slapper,https://www.reddit.com/r/dadjokes/comments/ifew9x/hey_my_first_joke_here_is_about_patella_injuries/
dadjokes,2020-08-24 00:03:32,Best time to break out the backup cheese ,ifb8px,21,5,In queso emergency,https://www.reddit.com/r/dadjokes/comments/ifb8px/best_time_to_break_out_the_backup_cheese/
dadjokes,2020-08-24 04:37:47,My son had a rough time at little league practice   after striking out three times  he lost interest and wouldn t stop smelling the dandelions in the outfield  getting one stuck in his nose ,iffsw6,9,1,He really whiffed hard,https://www.reddit.com/r/dadjokes/comments/iffsw6/my_son_had_a_rough_time_at_little_league_practice/
dadjokes,2020-08-24 10:34:31,Why did the fool start collecting little insects after learning about covid ,ifkkb9,4,0,He figured he needed antibodies,https://www.reddit.com/r/dadjokes/comments/ifkkb9/why_did_the_fool_start_collecting_little_insects/
