subreddit_topic,subreddit_time_created,subreddit_title,subreddit_id,subreddit_score,subreddit_num_comments,subreddit_body,subreddit_url
dadjokes,2020-08-23 01:04:45,A man burst into a ski resort in Vale  Colorado ,iergj6,30,4,He shouted into the room   Everywhere I go  there s a black bird that sticks to me  He sticks to my fleece jacket  my wool hat  even my velvet gloves    The concierge shakes his head and says   Oh  that s just the Vale crow  ,https://www.reddit.com/r/dadjokes/comments/iergj6/a_man_burst_into_a_ski_resort_in_vale_colorado/
dadjokes,2020-08-22 12:20:19,What has two butts and kills people ,iefg75,338,18,An assassin,https://www.reddit.com/r/dadjokes/comments/iefg75/what_has_two_butts_and_kills_people/
dadjokes,2020-08-22 15:31:54,What do you call two dudes who love math ,iehmcd,180,11,Algebros,https://www.reddit.com/r/dadjokes/comments/iehmcd/what_do_you_call_two_dudes_who_love_math/
dadjokes,2020-08-23 06:38:02,hey did you hear about the guy who cut off the left half of his body  ,ieweag,9,3,  he s all right now,https://www.reddit.com/r/dadjokes/comments/ieweag/hey_did_you_hear_about_the_guy_who_cut_off_the/
dadjokes,2020-08-23 01:36:37,The Beavers have the ugliest house in the neighborhood ,ierztk,25,3,It s a dam shame,https://www.reddit.com/r/dadjokes/comments/ierztk/the_beavers_have_the_ugliest_house_in_the/
dadjokes,2020-08-23 18:54:58,Did you know Russia has built a special computer for the Czar to use in the event they ever bring the monarchy back ,if5kdl,1,0,It s called the Rasputer,https://www.reddit.com/r/dadjokes/comments/if5kdl/did_you_know_russia_has_built_a_special_computer/
dadjokes,2020-08-23 12:43:19,Do you know who I bumped into at the opticians,if0i1f,4,1,Everybody,https://www.reddit.com/r/dadjokes/comments/if0i1f/do_you_know_who_i_bumped_into_at_the_opticians/
dadjokes,2020-08-23 18:29:04,I wonder if I ll get smaller when I m a therapist,if54gx,1,0,Cause then I ll be a shrink,https://www.reddit.com/r/dadjokes/comments/if54gx/i_wonder_if_ill_get_smaller_when_im_a_therapist/
dadjokes,2020-08-23 04:01:24,What did the lungs say to the bladder when they went on strike,ieu8tt,16,0,Urine trouble,https://www.reddit.com/r/dadjokes/comments/ieu8tt/what_did_the_lungs_say_to_the_bladder_when_they/
dadjokes,2020-08-23 21:51:18,A woman is like a face mask  you don t share it with anyone whilst a man is like a sanitzer,if8stk,0,2,Everybody can use it,https://www.reddit.com/r/dadjokes/comments/if8stk/a_woman_is_like_a_face_mask_you_dont_share_it/
dadjokes,2020-08-23 03:51:15,I ve decided to put an end to color based segregation in my household   ,ieu3hj,12,1,   however my wife disagrees  and is no longer letting me use the washing machine,https://www.reddit.com/r/dadjokes/comments/ieu3hj/ive_decided_to_put_an_end_to_colorbased/
dadjokes,2020-08-22 19:06:02,Today I rewrote history,iel2uv,59,4,  History    History,https://www.reddit.com/r/dadjokes/comments/iel2uv/today_i_rewrote_history/
dadjokes,2020-08-23 07:34:35,I left my job at the Chinese restaurant and took my favourite frying pan  until I heard the owner yell   ,iex4rg,7,2, Don t wok away from me  ,https://www.reddit.com/r/dadjokes/comments/iex4rg/i_left_my_job_at_the_chinese_restaurant_and_took/
dadjokes,2020-08-23 11:19:54,What do you call someone who doesn t have an account ,iezmt8,2,0,An accountant  account nt ,https://www.reddit.com/r/dadjokes/comments/iezmt8/what_do_you_call_someone_who_doesnt_have_an/
dadjokes,2020-08-23 13:23:58,What Is Jackie Chan s Favourite Drink,if0x20,2,2,WATAAAARRR,https://www.reddit.com/r/dadjokes/comments/if0x20/what_is_jackie_chans_favourite_drink/
dadjokes,2020-08-23 13:02:07, It s a pleasure to be here as the keynote speaker for  The Purple Fruit Growers Association   said Tom,if0okf,2,1,with much aplomb,https://www.reddit.com/r/dadjokes/comments/if0okf/its_a_pleasure_to_be_here_as_the_keynote_speaker/
dadjokes,2020-08-23 10:46:52,What is the name the old Pokémon GO ,iezabc,2,7,Pokémon WENT,https://www.reddit.com/r/dadjokes/comments/iezabc/what_is_the_name_the_old_pokémon_go/
dadjokes,2020-08-23 12:57:10,So I was reading the book  Caps For Sale  to my seven year old kid   ,if0msu,2,1,He looks at the peddler and goes   wow  that guy really has a lot on his head  ,https://www.reddit.com/r/dadjokes/comments/if0msu/so_i_was_reading_the_book_caps_for_sale_to_my/
dadjokes,2020-08-23 06:05:57,What did one burp say to the other burp,ievz30,7,5,Let s be stinkers and go out the other end     My stepdad told me this when I was little and every once and a while I think of it and it makes me smile  I thought it would do the same for you,https://www.reddit.com/r/dadjokes/comments/ievz30/what_did_one_burp_say_to_the_other_burp/
dadjokes,2020-08-23 05:04:48,What farm animals are good for the environment ,iev51f,9,1,Recyclebulls,https://www.reddit.com/r/dadjokes/comments/iev51f/what_farm_animals_are_good_for_the_environment/
dadjokes,2020-08-22 20:34:23,Had a dream I was a muffler   ,iemo8o,35,1,Woke up exhausted,https://www.reddit.com/r/dadjokes/comments/iemo8o/had_a_dream_i_was_a_muffler/
dadjokes,2020-08-22 17:16:03,Why was the pig covered in ink ,iej6q3,68,4,Because he lives in a pen     Credit to my 8 year old daughter  who probably read this in  Highlights  kids magazine,https://www.reddit.com/r/dadjokes/comments/iej6q3/why_was_the_pig_covered_in_ink/
dadjokes,2020-08-23 07:02:04,My friend texted me saying he jumped off a tower  I said yeah right   ,iewpnw,5,0,He says  I m dead serious  ,https://www.reddit.com/r/dadjokes/comments/iewpnw/my_friend_texted_me_saying_he_jumped_off_a_tower/
dadjokes,2020-08-23 02:11:26,What do you call a dog with no back legs and balls of steel ,ieskcr,13,2,Sparky,https://www.reddit.com/r/dadjokes/comments/ieskcr/what_do_you_call_a_dog_with_no_back_legs_and/
dadjokes,2020-08-23 15:25:26,What language does PG Tips speak,if2akh,0,0,Teabrew,https://www.reddit.com/r/dadjokes/comments/if2akh/what_language_does_pg_tips_speak/
dadjokes,2020-08-23 05:25:04,What s a baker s favorite dress shoe ,ievf6v,6,0,Loafers,https://www.reddit.com/r/dadjokes/comments/ievf6v/whats_a_bakers_favorite_dress_shoe/
dadjokes,2020-08-23 11:15:19,I friend of mine got married   ,iezl4a,2,0,She got a new name and a dress out of it,https://www.reddit.com/r/dadjokes/comments/iezl4a/i_friend_of_mine_got_married/
dadjokes,2020-08-22 20:35:43,What do you call a sailor who you don t like ,iemp5f,29,5,A w anchor,https://www.reddit.com/r/dadjokes/comments/iemp5f/what_do_you_call_a_sailor_who_you_dont_like/
dadjokes,2020-08-23 01:44:51,My psychiatrist and I had a major breakthrough,ies4u4,9,1,Now he can hear the voices too,https://www.reddit.com/r/dadjokes/comments/ies4u4/my_psychiatrist_and_i_had_a_major_breakthrough/
dadjokes,2020-08-22 20:05:22,What type of blood do people from Taiwan have ,iem5gt,33,1,Taipei,https://www.reddit.com/r/dadjokes/comments/iem5gt/what_type_of_blood_do_people_from_taiwan_have/
dadjokes,2020-08-22 15:31:49,My girlfriend gave me an ultimatum  I have to choose between her and my career as a news reporter ,iehmat,74,3,I have some breaking news for her,https://www.reddit.com/r/dadjokes/comments/iehmat/my_girlfriend_gave_me_an_ultimatum_i_have_to/
dadjokes,2020-08-21 16:48:26,The leading cause of dry skin,idx1iw,8780,93,A towel     Got em,https://www.reddit.com/r/dadjokes/comments/idx1iw/the_leading_cause_of_dry_skin/
dadjokes,2020-08-23 20:06:11,My girlfriend likes dog food lid backwards,if6top,0,0,Cuz its  dildo of god ,https://www.reddit.com/r/dadjokes/comments/if6top/my_girlfriend_likes_dog_food_lid_backwards/
dadjokes,2020-08-23 04:17:38,Why do seagulls live near the sea ,ieuhdq,7,2,If they lived by the bay  they d be baygulls,https://www.reddit.com/r/dadjokes/comments/ieuhdq/why_do_seagulls_live_near_the_sea/
dadjokes,2020-08-23 03:27:15,Want to know the best way to avoid accidents ,ietqtg,8,0,Get a Dodge,https://www.reddit.com/r/dadjokes/comments/ietqtg/want_to_know_the_best_way_to_avoid_accidents/
dadjokes,2020-08-22 15:49:58,As I handed my dad his 50th birthday card  he looked at me with tears in his eyes and said ,iehuug,59,7,Y know  one would have been enough,https://www.reddit.com/r/dadjokes/comments/iehuug/as_i_handed_my_dad_his_50th_birthday_card_he/
dadjokes,2020-08-22 20:46:09,My friend thinks he s a paranoid,iemw1x,24,2,I said  don t worry  You re not alone,https://www.reddit.com/r/dadjokes/comments/iemw1x/my_friend_thinks_hes_a_paranoid/
dadjokes,2020-08-23 03:58:30,What s the only root veggie that comes with a warning ,ieu770,5,2,Butternut squash,https://www.reddit.com/r/dadjokes/comments/ieu770/whats_the_only_root_veggie_that_comes_with_a/
dadjokes,2020-08-23 07:13:43,Although at times the cops were able to catch up to that orange car on the Dukes of Hazard tv show   ,iewvas,4,0,   GeneralLee they weren t fast enough,https://www.reddit.com/r/dadjokes/comments/iewvas/although_at_times_the_cops_were_able_to_catch_up/
dadjokes,2020-08-23 12:45:57,One afternoon  I was walking past a ground  when I looked up and saw something strange  white  circular  floating right beside the moon ,if0iz7,1,0,I kept staring at it  dumbfounded as to what it could be        Then it hit me,https://www.reddit.com/r/dadjokes/comments/if0iz7/one_afternoon_i_was_walking_past_a_ground_when_i/
dadjokes,2020-08-23 06:45:40,My wife and 2yo were just watching Paw Patrol  There is a cow mooing into a cell phone to video chat with the team to ask for help for a cat stuck on the roof ,iewhz9,3,0,I told my wife  That cat would have way more grip on roof shingles and I expect more I realism from talking cartoon cows  This is  UDDERLY  ridiculous      She may have buried her head and avoided eye contact for a bit  I was proud,https://www.reddit.com/r/dadjokes/comments/iewhz9/my_wife_and_2yo_were_just_watching_paw_patrol/
dadjokes,2020-08-22 23:57:27,A sheep died ,ieqaq5,10,2,a ewwlogie followed,https://www.reddit.com/r/dadjokes/comments/ieqaq5/a_sheep_died/
dadjokes,2020-08-23 16:09:38,What s three inches long but smells like a foot ,if2wii,0,5,A babies foot  dirty minds,https://www.reddit.com/r/dadjokes/comments/if2wii/whats_three_inches_long_but_smells_like_a_foot/
dadjokes,2020-08-23 04:51:27,What do you call an artist who draws lewd pictures of a shotgun ,ieuye3,5,4,an r870 artist,https://www.reddit.com/r/dadjokes/comments/ieuye3/what_do_you_call_an_artist_who_draws_lewd/
dadjokes,2020-08-23 04:50:27,I carry dietary fiber with me instead of a knife when I leave the house   ,ieuxwd,3,0,I can t tell you how many times it s saved my ass,https://www.reddit.com/r/dadjokes/comments/ieuxwd/i_carry_dietary_fiber_with_me_instead_of_a_knife/
dadjokes,2020-08-23 08:23:35,Wallace and gromit have released a new evil ,iexqhj,2,0,The cheese and krackern,https://www.reddit.com/r/dadjokes/comments/iexqhj/wallace_and_gromit_have_released_a_new_evil/
dadjokes,2020-08-21 14:33:14,What s six inches long  has a bald head and every woman loves ,idv1q3,8776,140,A hundred dollar bill     This is my dad s favorite joke   ,https://www.reddit.com/r/dadjokes/comments/idv1q3/whats_six_inches_long_has_a_bald_head_and_every/
dadjokes,2020-08-22 18:09:04,Kid  dad  did you get a haircut ,iek2fv,25,1,Dad  no  I got them all cut,https://www.reddit.com/r/dadjokes/comments/iek2fv/kid_dad_did_you_get_a_haircut/
dadjokes,2020-08-23 03:07:39,I loved first grade   ,ietfre,4,1,Best three years of my life,https://www.reddit.com/r/dadjokes/comments/ietfre/i_loved_first_grade/
dadjokes,2020-08-23 04:17:43,Watching the latest episode of Forged in Fire  In the sharpness test  Doug Marcaida tested how much bread each blade would cut with just one slice   ,ieuhez,5,2, The winner was so lucky he made a 4 loaf cleaver,https://www.reddit.com/r/dadjokes/comments/ieuhez/watching_the_latest_episode_of_forged_in_fire_in/
dadjokes,2020-08-22 15:30:55,My girlfriend is the square root of   100,iehlvo,41,3,She s a perfect 10  but completely imaginary,https://www.reddit.com/r/dadjokes/comments/iehlvo/my_girlfriend_is_the_square_root_of_100/
dadjokes,2020-08-22 20:21:20,My 9yr old came up with  How do you greet someone who is laughing quietly ,iemft5,16,4,With  a low ha   aloha ,https://www.reddit.com/r/dadjokes/comments/iemft5/my_9yr_old_came_up_with_how_do_you_greet_someone/
dadjokes,2020-08-23 11:10:27,What s the name of that Nora Jones Song ,iezj73,1,0,Don t know  Why,https://www.reddit.com/r/dadjokes/comments/iezj73/whats_the_name_of_that_nora_jones_song/
dadjokes,2020-08-22 20:25:54,Why did the scarecrow get a promotion ,iemiph,12,1,Because he was outstanding in his field,https://www.reddit.com/r/dadjokes/comments/iemiph/why_did_the_scarecrow_get_a_promotion/
dadjokes,2020-08-22 17:16:43,Diarrhea is hereditary ,iej74t,24,3,It runs in your jeans,https://www.reddit.com/r/dadjokes/comments/iej74t/diarrhea_is_hereditary/
dadjokes,2020-08-22 21:32:03,Why can you take multiple mushrooms,ienqip,9,3,They don t take up mushroom,https://www.reddit.com/r/dadjokes/comments/ienqip/why_can_you_take_multiple_mushrooms/
dadjokes,2020-08-22 21:55:19,Why don t lobsters ever share ,ieo5ni,9,3,Because they re shell fish   First child due in April  ,https://www.reddit.com/r/dadjokes/comments/ieo5ni/why_dont_lobsters_ever_share/
dadjokes,2020-08-22 23:31:49,I don t know if it s the best anti joke but here is my favorite one ,iepvjx,7,2,One,https://www.reddit.com/r/dadjokes/comments/iepvjx/i_dont_know_if_its_the_best_antijoke_but_here_is/
dadjokes,2020-08-22 17:45:30,I tried to make a belt out of Italian herbs  but it didn t work,iejobc,20,2,It was just a waist of thyme,https://www.reddit.com/r/dadjokes/comments/iejobc/i_tried_to_make_a_belt_out_of_italian_herbs_but/
dadjokes,2020-08-23 03:06:15,How does Melania call Donald to supper ,ieteyg,3,4, Donald  come tweet  ,https://www.reddit.com/r/dadjokes/comments/ieteyg/how_does_melania_call_donald_to_supper/
dadjokes,2020-08-22 16:37:35,To whoever stole my Microsoft Office     ,ieikza,20,8,I will find you  You have my Word,https://www.reddit.com/r/dadjokes/comments/ieikza/to_whoever_stole_my_microsoft_office/
dadjokes,2020-08-23 00:57:55,Why did the baker have brown fingers ,ierc8r,3,0,He neaded a poo,https://www.reddit.com/r/dadjokes/comments/ierc8r/why_did_the_baker_have_brown_fingers/
dadjokes,2020-08-23 00:57:21,Jaundice setup,ierbwp,4,0,I officially became a father a few days ago  My sweet daughter has a some jaundice so we ve had to stay in the hospital a few more days for treatment   The nurse lugged I a big box and said  we are going start light therapy   Me  looks heavy ,https://www.reddit.com/r/dadjokes/comments/ierbwp/jaundice_setup/
dadjokes,2020-08-22 11:12:06,What do you call a cavemans fart ,ieermq,52,2,A blast from the past,https://www.reddit.com/r/dadjokes/comments/ieermq/what_do_you_call_a_cavemans_fart/
dadjokes,2020-08-23 12:10:43,One day a man went to an auction ,if0617,0,0,While there he bid on a parrot   He really wanted this bird  so he kept on bidding but kept on getting outbid   Got to lazy to finish the joke sorry,https://www.reddit.com/r/dadjokes/comments/if0617/one_day_a_man_went_to_an_auction/
dadjokes,2020-08-23 02:13:43,When Stephen Curry is late what do you call him ,iesll1,3,0,Stephen Hurry,https://www.reddit.com/r/dadjokes/comments/iesll1/when_stephen_curry_is_late_what_do_you_call_him/
dadjokes,2020-08-22 22:21:53,What are you if you inherit a milk farm ,ieoml9,7,0,A derriere,https://www.reddit.com/r/dadjokes/comments/ieoml9/what_are_you_if_you_inherit_a_milk_farm/
dadjokes,2020-08-22 14:56:24,When we got married  my wife had a ladder  but I didn t   ,ieh6ei,26,0,Now I have a step ladder,https://www.reddit.com/r/dadjokes/comments/ieh6ei/when_we_got_married_my_wife_had_a_ladder_but_i/
dadjokes,2020-08-22 18:26:02,Did you know the first French fries weren t actually cooked in France ,iekcxz,11,2,They were cooked in Greece    ,https://www.reddit.com/r/dadjokes/comments/iekcxz/did_you_know_the_first_french_fries_werent/
dadjokes,2020-08-22 23:47:33,What does a 6 10  Irishman with a sunburn have in common with the star named Betelgeuse ,ieq4vw,4,6,They re both red giants  and way bigger than my son sun ,https://www.reddit.com/r/dadjokes/comments/ieq4vw/what_does_a_610_irishman_with_a_sunburn_have_in/
dadjokes,2020-08-22 15:35:58,If everyone in the world linked hands and stood in a straight line,ieho69,18,2,Most of them would drown,https://www.reddit.com/r/dadjokes/comments/ieho69/if_everyone_in_the_world_linked_hands_and_stood/
dadjokes,2020-08-22 15:54:10,My wife tells me I ve spent too much money on mirrors ,iehx0o,18,1,I guess it s time for some self reflection,https://www.reddit.com/r/dadjokes/comments/iehx0o/my_wife_tells_me_ive_spent_too_much_money_on/
dadjokes,2020-08-22 12:04:28,What do you call a cow that doesn t feel pain ,iefafj,32,3,C,https://www.reddit.com/r/dadjokes/comments/iefafj/what_do_you_call_a_cow_that_doesnt_feel_pain/
dadjokes,2020-08-22 21:15:08,I was eating Blueberry Wheats cereal when I asked my daughter  What is a ghost s favourite cereal  ,ienfls,7,2,She rolled her eyes and said  Booberry Wheats  obviously   I said  No  it s     and then in a super spooky ghost voice      WeeeeEEEEeeeetabix   She laughed so hard she choked on her food,https://www.reddit.com/r/dadjokes/comments/ienfls/i_was_eating_blueberry_wheats_cereal_when_i_asked/
dadjokes,2020-08-23 00:44:42,Why did Carl Wheezer go to jail,ier452,2,0,Armed Quassult,https://www.reddit.com/r/dadjokes/comments/ier452/why_did_carl_wheezer_go_to_jail/
dadjokes,2020-08-23 02:53:09,I saw my neighbor and his family crying this morning,iet7lr,2,0,They just got back from a moving sale,https://www.reddit.com/r/dadjokes/comments/iet7lr/i_saw_my_neighbor_and_his_family_crying_this/
dadjokes,2020-08-22 18:22:27,My little Sister  What s more amazing than a talking dog ,iekajd,8,0,Me  What   Her  A spelling bee,https://www.reddit.com/r/dadjokes/comments/iekajd/my_little_sister_whats_more_amazing_than_a/
dadjokes,2020-08-23 00:10:26,What does the Mexican carpet fitter say whenever he lays a new floor ,ieqipw,3,0,Underlay  Underlay,https://www.reddit.com/r/dadjokes/comments/ieqipw/what_does_the_mexican_carpet_fitter_say_whenever/
dadjokes,2020-08-23 02:20:00,A filmmaker is auditioning for a movie based on famous classical composers ,iesouu,1,0,Arnold Schwarzenegger walks in and says  I ll be Bach ,https://www.reddit.com/r/dadjokes/comments/iesouu/a_filmmaker_is_auditioning_for_a_movie_based_on/
dadjokes,2020-08-22 17:30:37,Just came up with this one,iejfce,10,2,Did you hear about the law office that just won a huge settlement for a dental firm    They did such a good job  the dentists put them on permanent retainer,https://www.reddit.com/r/dadjokes/comments/iejfce/just_came_up_with_this_one/
dadjokes,2020-08-22 15:58:13,A slice of pie in the Bahamas is  2 00  a slice of pie in Jamaica is  2 50   ,iehz5y,13,1,The Pie rates of the Caribbean,https://www.reddit.com/r/dadjokes/comments/iehz5y/a_slice_of_pie_in_the_bahamas_is_200_a_slice_of/
dadjokes,2020-08-22 14:06:49,The other day  my hot friend told me he could sign a piece of paper with his hotness ,ieglsi,16,1,Me  being fed up with him always boasting  I asked   How could you even do that    With a smug smile plastered on his face  he replied   Thermal Signature  ,https://www.reddit.com/r/dadjokes/comments/ieglsi/the_other_day_my_hot_friend_told_me_he_could_sign/
dadjokes,2020-08-22 04:58:49,I ve got this awful disease where I can t stop telling airport jokes ,iea3ld,92,9,  My doctor says it s terminal,https://www.reddit.com/r/dadjokes/comments/iea3ld/ive_got_this_awful_disease_where_i_cant_stop/
dadjokes,2020-08-22 19:51:31,What s it called when a person from the Middle East takes a really bad tumble ,ielwb9,7,0,Falafel,https://www.reddit.com/r/dadjokes/comments/ielwb9/whats_it_called_when_a_person_from_the_middle/
dadjokes,2020-08-22 20:49:26,Want to go see a meteor shower ,iemya5,6,2,What are you  some kind of perv,https://www.reddit.com/r/dadjokes/comments/iemya5/want_to_go_see_a_meteor_shower/
dadjokes,2020-08-23 01:40:17,If you throw a merengue,ies20s,2,0,Does it only come half way back,https://www.reddit.com/r/dadjokes/comments/ies20s/if_you_throw_a_merengue/
dadjokes,2020-08-21 18:36:36,My addiction to refrigerated poultry has gone too far,idyz7b,589,22,I m quitting cold turkey,https://www.reddit.com/r/dadjokes/comments/idyz7b/my_addiction_to_refrigerated_poultry_has_gone_too/
dadjokes,2020-08-22 19:20:08,After getting a lot of negative reviews due to their rather poor string section  the LAPD Police Band decided to lose all the strings from their performances ,ielbw8,6,1,It was finally the long awaited end of police violins,https://www.reddit.com/r/dadjokes/comments/ielbw8/after_getting_a_lot_of_negative_reviews_due_to/
dadjokes,2020-08-22 06:21:37,The reposts in this app are getting really annoying,ieb9x5,68,7,Because I ve reddit all already,https://www.reddit.com/r/dadjokes/comments/ieb9x5/the_reposts_in_this_app_are_getting_really/
dadjokes,2020-08-22 16:28:33,Did you hear about the gay Irish couple ,ieiful,11,3,Patrick Fitzgerald and Gerald Fitzpatrick,https://www.reddit.com/r/dadjokes/comments/ieiful/did_you_hear_about_the_gay_irish_couple/
dadjokes,2020-08-21 05:09:54,A woman is walking through the park when she sees a very attractive man sitting on a park bench  He s reading a book and eating some fruit out of a Tupperware container  Slowly the woman gathers the courage to go ask the man out   ,ido0rs,16473,333, So  she walks over and takes a seat next to him on the bench  turns to him and says   Sorry to bother you  I know this may be a little forward but I would love to grab coffee with you some time     Flattered  the man responds   Sure    but what makes you so certain you and I would get along so well     Well     the woman says   A couple things  actually  I noticed you were wearing an Iron Maiden t shirt  Iron Maiden are my favorite band of all time  When they went on their reunion tour in 1999  my parents took me to see them in Cleveland  I was 12 years old and it was the first concert I ever went to  I absolutely love Iron Maiden    The man can t believe it     I saw them play Cleveland in  99  First concert I ever went to on my own  My best friend Jimmy Spitz and I told our parents we were sleeping at each others  houses  snuck out  took a bus into the city and saw them play at the Plain Dealer Pavillion     Naturally  they re both shocked    If that isn t weird enough     says the woman   I noticed you re reading Mark Twain  I was a communications major in university and I actually wrote my thesis on Mark Twain and how he used satire as a lens to comment on current events of the time  comparing him to satirical news sources of today  He s my favorite author    Now the man is really taken aback   Get out of here  I was an English major in university  I specialized in 19th century American literature and this is like my fourth or fifth time reading Tom Sawyer  I absolutely love Mark Twain    They both can t believe it   this has got to be a match made in heaven    Ok     the woman says   Well  buckle up because here s the icing on the cake  I noticed you re eating a prune  Prunes are my absolute favorite fruit  When I was a kid  my grandfather lived on a farm  He had an orchard that mainly grew apples and some lemons  but he knew how much my sister and I loved prunes so he kept a couple of plum trees  Every year at the end of the summer  we d go up and harvest the plums with him  He d dry them and by the time we d go back to his place for Thanksgiving he d always have those prunes saved just for us  They re my favorite fruit  I love prunes  you re eating a prune  this has got to be fate  What do you say    The man puts down his fruit and responds     It s a date   ,https://www.reddit.com/r/dadjokes/comments/ido0rs/a_woman_is_walking_through_the_park_when_she_sees/
dadjokes,2020-08-23 04:53:21,Why fid the percussionist wear ear plugs ,ieuze9,1,0,because if he didn t he d break his ear Drums,https://www.reddit.com/r/dadjokes/comments/ieuze9/why_fid_the_percussionist_wear_ear_plugs/
dadjokes,2020-08-23 04:45:20,Two old women were sat on a park bench when a flasher pops out   ,ieuvdv,0,0,One had a stroke  the other couldn t reach,https://www.reddit.com/r/dadjokes/comments/ieuvdv/two_old_women_were_sat_on_a_park_bench_when_a/
dadjokes,2020-08-22 19:50:16,Two Corinthians walk into a DC bar ,ielvf8,3,3,One says to the bartender   This is a fancy capital  ,https://www.reddit.com/r/dadjokes/comments/ielvf8/two_corinthians_walk_into_a_dc_bar/
dadjokes,2020-08-22 15:31:48,My friend from Paris took part in a national barista contest,iehmal,11,1,And he won  I read it in the French press,https://www.reddit.com/r/dadjokes/comments/iehmal/my_friend_from_paris_took_part_in_a_national/
dadjokes,2020-08-22 17:41:23,The teacher kicks me out of our class,iejlvf,7,0,Now I m outstanding,https://www.reddit.com/r/dadjokes/comments/iejlvf/the_teacher_kicks_me_out_of_our_class/
dadjokes,2020-08-22 11:13:41,I used to have a severe addiction to soap,iees9q,22,1,I m clean now,https://www.reddit.com/r/dadjokes/comments/iees9q/i_used_to_have_a_severe_addiction_to_soap/
dadjokes,2020-08-22 16:42:39,A median and a mode walk into a bar   ,ieinv0,9,5,The bartender says   I m glad you dumped your buddy  He s mean  ,https://www.reddit.com/r/dadjokes/comments/ieinv0/a_median_and_a_mode_walk_into_a_bar/
dadjokes,2020-08-22 22:02:04,I working on  Warcraft   The Musical   The songs write themselves ,ieo9y4,2,1,  My horde will go on   Alliance sleeps tonight   A horde day s night,https://www.reddit.com/r/dadjokes/comments/ieo9y4/i_working_on_warcraft_the_musical_the_songs_write/
dadjokes,2020-08-22 12:34:26,Why did the scarecrow win a Nobel Prize ,ieflfx,18,0,For being out standing in his field,https://www.reddit.com/r/dadjokes/comments/ieflfx/why_did_the_scarecrow_win_a_nobel_prize/
