subreddit_topic,subreddit_time_created,subreddit_title,subreddit_id,subreddit_score,subreddit_num_comments,subreddit_body,subreddit_url
dadjokes,2020-08-20 05:59:16,I m working on my dad bod,id2egk,32,0,I want to be a good father figure,https://www.reddit.com/r/dadjokes/comments/id2egk/im_working_on_my_dad_bod/
dadjokes,2020-08-19 18:27:52, Officer  how did the hackers get away  ,icpsg6,264,8, No idea  They must have ransomware  ,https://www.reddit.com/r/dadjokes/comments/icpsg6/officer_how_did_the_hackers_get_away/
dadjokes,2020-08-20 20:49:27,One of the founders of a large company called Aloecorp  Inc  recently got divorced,idf3td,2,0,His wife is seeking aloemoney,https://www.reddit.com/r/dadjokes/comments/idf3td/one_of_the_founders_of_a_large_company_called/
dadjokes,2020-08-20 13:29:31,As we sat down for lunch  I proudly announced to my daughter   Little known fact  the first French fries weren t actually cooked in France   Unimpressed  she ignored me and kept eating  Not being one to give up  I continued   ,id7tfn,9,3, Nope  they were cooked in Greece  ,https://www.reddit.com/r/dadjokes/comments/id7tfn/as_we_sat_down_for_lunch_i_proudly_announced_to/
dadjokes,2020-08-20 09:17:34,I m good at manicures but bad at languages ,id50pg,17,0,Although I think I would nail Polish,https://www.reddit.com/r/dadjokes/comments/id50pg/im_good_at_manicures_but_bad_at_languages/
dadjokes,2020-08-20 23:59:16,I wanted some pasta,idis4u,1,0,I wanted some pasta but I didn t have any  this calls for a RAVIOL oution,https://www.reddit.com/r/dadjokes/comments/idis4u/i_wanted_some_pasta/
dadjokes,2020-08-20 08:52:25,I was a gifted child,id4qc0,16,0,Yeah  still haven t met my real parents yet,https://www.reddit.com/r/dadjokes/comments/id4qc0/i_was_a_gifted_child/
dadjokes,2020-08-20 01:28:46,Vampires don t really exist ,icxzq4,61,7,Well  unless you Count Dracula,https://www.reddit.com/r/dadjokes/comments/icxzq4/vampires_dont_really_exist/
dadjokes,2020-08-20 23:38:55,What time is it ,idiedm,0,4,GAME TIME   OUFF,https://www.reddit.com/r/dadjokes/comments/idiedm/what_time_is_it/
dadjokes,2020-08-20 13:47:47,I asked my Indian neighbour if I could borrow some bread   ,id8165,6,5,He said he had naan,https://www.reddit.com/r/dadjokes/comments/id8165/i_asked_my_indian_neighbour_if_i_could_borrow/
dadjokes,2020-08-20 06:59:50,Son    Hi Dad  I m hungry   I am prepared for what he has to say ,id39fw,21,7,Dad   let s order some food,https://www.reddit.com/r/dadjokes/comments/id39fw/son_hi_dad_im_hungry_i_am_prepared_for_what_he/
dadjokes,2020-08-20 09:01:43,I went to the bottle shop the other day on my bicycle   ,id4u7x,12,1,bought a bottle of whiskey and put it in the bicycle basket  As I  was about to leave  I thought to myself that if I fell off my bike  the bottle would break   So  I drank all the whiskey and then rode home    It turned out to be a very good decision  because I fell off the bike seven times on the way home,https://www.reddit.com/r/dadjokes/comments/id4u7x/i_went_to_the_bottle_shop_the_other_day_on_my/
dadjokes,2020-08-20 16:55:12,What is old and wrinkly and hangs out your jocks ,idapte,3,0,Grandma,https://www.reddit.com/r/dadjokes/comments/idapte/what_is_old_and_wrinkly_and_hangs_out_your_jocks/
dadjokes,2020-08-20 00:49:25,I walked into the bedroom today and tripped over my wife s bra ,icx9h8,56,5,It was a booby trap,https://www.reddit.com/r/dadjokes/comments/icx9h8/i_walked_into_the_bedroom_today_and_tripped_over/
dadjokes,2020-08-20 11:21:44,A storm blew away 75  of my roof,id6dpi,9,3,F,https://www.reddit.com/r/dadjokes/comments/id6dpi/a_storm_blew_away_75_of_my_roof/
dadjokes,2020-08-20 01:43:39,I think my wife is putting glue on my antique weapons collection ,icy9ad,47,1,Of course she denies it  but I m sticking to my guns,https://www.reddit.com/r/dadjokes/comments/icy9ad/i_think_my_wife_is_putting_glue_on_my_antique/
dadjokes,2020-08-20 18:35:10,I just wrote a song about tortilla s,idcimc,2,1,It s a  w rap,https://www.reddit.com/r/dadjokes/comments/idcimc/i_just_wrote_a_song_about_tortillas/
dadjokes,2020-08-20 11:21:15,I was gonna make a dubstep joke,id6di6,7,2,But I ll just drop it,https://www.reddit.com/r/dadjokes/comments/id6di6/i_was_gonna_make_a_dubstep_joke/
dadjokes,2020-08-20 17:48:37,What do you call a stain in the Alps ,idbn0t,2,0,Liechtenstain,https://www.reddit.com/r/dadjokes/comments/idbn0t/what_do_you_call_a_stain_in_the_alps/
dadjokes,2020-08-20 14:00:18,I fell asleep in the cab and later I woke up with my liver missing,id86kl,3,0,I m starting to think that the driver who said he ll  deliver me  was a bit shady,https://www.reddit.com/r/dadjokes/comments/id86kl/i_fell_asleep_in_the_cab_and_later_i_woke_up_with/
dadjokes,2020-08-20 08:26:13,Ever since my son told me he wanted a sex change they ve stopped acknowledging me,id4eu9,13,1,I guess now I m transparent,https://www.reddit.com/r/dadjokes/comments/id4eu9/ever_since_my_son_told_me_he_wanted_a_sex_change/
dadjokes,2020-08-21 03:11:11,Kids today don t know they re born   ,idm5ht,0,0,Seriously  I checked the syllabus  They re not teaching this in schools,https://www.reddit.com/r/dadjokes/comments/idm5ht/kids_today_dont_know_theyre_born/
dadjokes,2020-08-21 03:06:17,911 what s your emergency  MY BABY GOAT WAS STOLEN ,idm2p7,0,1,Dispatcher  I m contacting animal control  Citizen  animal control  I d like to report a kid napping,https://www.reddit.com/r/dadjokes/comments/idm2p7/911_whats_your_emergency_my_baby_goat_was_stolen/
dadjokes,2020-08-20 03:12:59,I like telling dad jokes,iczrp2,26,2,Sometimes he laughs,https://www.reddit.com/r/dadjokes/comments/iczrp2/i_like_telling_dad_jokes/
dadjokes,2020-08-19 20:22:05,To the person who stole my antidepressants ,ics0w4,86,7,I hope you are happy now,https://www.reddit.com/r/dadjokes/comments/ics0w4/to_the_person_who_stole_my_antidepressants/
dadjokes,2020-08-19 23:48:36,I submitted nearly a dozen entries to a dad joke competition  hoping one would win ,icw3ek,40,2,Unfortunately  no pun in ten did,https://www.reddit.com/r/dadjokes/comments/icw3ek/i_submitted_nearly_a_dozen_entries_to_a_dad_joke/
dadjokes,2020-08-19 17:15:09,I decided to rub ketchup in my eyes,icof2a,137,12,In Heinz sight it wasn t a good idea,https://www.reddit.com/r/dadjokes/comments/icof2a/i_decided_to_rub_ketchup_in_my_eyes/
dadjokes,2020-08-20 09:23:45,Why did the lost disciple enter a male strip club ,id53cw,9,1,It was looking for guy dance,https://www.reddit.com/r/dadjokes/comments/id53cw/why_did_the_lost_disciple_enter_a_male_strip_club/
dadjokes,2020-08-20 13:04:34,I went on a date  and all she kept talking about for three hours was olive oil,id7iv7,4,0,I m thinking extra virgin,https://www.reddit.com/r/dadjokes/comments/id7iv7/i_went_on_a_date_and_all_she_kept_talking_about/
dadjokes,2020-08-20 11:22:31,A radioactive leak in China has thrown the country s widlife into chaos,id6e0u,5,2,Apparently it s absolute panda monium,https://www.reddit.com/r/dadjokes/comments/id6e0u/a_radioactive_leak_in_china_has_thrown_the/
dadjokes,2020-08-19 22:17:32,I have a question for people who take the bus   ,icuatp,39,4,Are you supposed to give it back,https://www.reddit.com/r/dadjokes/comments/icuatp/i_have_a_question_for_people_who_take_the_bus/
dadjokes,2020-08-20 07:06:47,The delivery guy accidentally got us 3 extra bags of flour,id3d3c,8,1,They were not kneaded,https://www.reddit.com/r/dadjokes/comments/id3d3c/the_delivery_guy_accidentally_got_us_3_extra_bags/
dadjokes,2020-08-19 22:08:29,I chuckle when I remember that my coins aren t moist ,icu4jt,36,2,It s my dry cents of humor,https://www.reddit.com/r/dadjokes/comments/icu4jt/i_chuckle_when_i_remember_that_my_coins_arent/
dadjokes,2020-08-20 03:34:01,How do you sign a check ,id03v1,12,1,I m asking  I don t know sign language,https://www.reddit.com/r/dadjokes/comments/id03v1/how_do_you_sign_a_check/
dadjokes,2020-08-20 11:19:34,why cant you have a 12 inch nose ,id6crs,4,0,Because it would be a foot then,https://www.reddit.com/r/dadjokes/comments/id6crs/why_cant_you_have_a_12_inch_nose/
dadjokes,2020-08-20 02:28:24,How do you deliver a baby ,icz17g,14,2,Put a stamp on it,https://www.reddit.com/r/dadjokes/comments/icz17g/how_do_you_deliver_a_baby/
dadjokes,2020-08-20 02:05:21,Clint Eastwood has three ears ,icymu9,17,1,His left ear  his right ear  and the Wild Frontier,https://www.reddit.com/r/dadjokes/comments/icymu9/clint_eastwood_has_three_ears/
dadjokes,2020-08-20 01:37:52,What did 2 say to 3 when they saw 6 acting like an idiot  ,icy5l8,16,1, Don t mind him  he s just a product of our times ,https://www.reddit.com/r/dadjokes/comments/icy5l8/what_did_2_say_to_3_when_they_saw_6_acting_like/
dadjokes,2020-08-20 02:18:09,I was asked if I could have any superpower in the world what would it be ,icyurb,15,4,I answered Cold war russia,https://www.reddit.com/r/dadjokes/comments/icyurb/i_was_asked_if_i_could_have_any_superpower_in_the/
dadjokes,2020-08-20 03:45:51,I started a twitter account devoted to non sequitors but had to shut it down,id0aoy,11,4,No followers,https://www.reddit.com/r/dadjokes/comments/id0aoy/i_started_a_twitter_account_devoted_to/
dadjokes,2020-08-20 09:09:50,Rick Harris hooked up with this girl using his brother Neil s pick up line   ,id4xn0,3,2,The questions is  will Neil Patrick Harris on the back,https://www.reddit.com/r/dadjokes/comments/id4xn0/rick_harris_hooked_up_with_this_girl_using_his/
dadjokes,2020-08-18 15:39:34,A girl came into my bookstore and asked  What are the chances you have a book on curing eating disorders with religion  ,ic083x,27519,257,Slim to Nun    Incidentally this is a true story and I got yelled at ,https://www.reddit.com/r/dadjokes/comments/ic083x/a_girl_came_into_my_bookstore_and_asked_what_are/
dadjokes,2020-08-20 05:50:19,I can t wait for Halloween this year ,id29kn,8,0,Everyone will be wearing masks,https://www.reddit.com/r/dadjokes/comments/id29kn/i_cant_wait_for_halloween_this_year/
dadjokes,2020-08-20 04:18:49,If you re ever going to Mount Rushmore,id0tje,9,0,Take your time,https://www.reddit.com/r/dadjokes/comments/id0tje/if_youre_ever_going_to_mount_rushmore/
dadjokes,2020-08-20 03:02:37,What kind of shoe does a Chinese cow wear ,iczloh,12,2,Mooshoe  mushu ,https://www.reddit.com/r/dadjokes/comments/iczloh/what_kind_of_shoe_does_a_chinese_cow_wear/
dadjokes,2020-08-20 07:04:58,Why don t Boeing planes crash,id3c64,6,0,They go Boooeing,https://www.reddit.com/r/dadjokes/comments/id3c64/why_dont_boeing_planes_crash/
dadjokes,2020-08-20 05:12:26,I can t stand hyperbole ,id1onk,9,0,It s the absolute worst,https://www.reddit.com/r/dadjokes/comments/id1onk/i_cant_stand_hyperbole/
dadjokes,2020-08-19 23:46:27,My doctor told me I had a short attention span,icw1um,19,1,I can t remember what he said after that,https://www.reddit.com/r/dadjokes/comments/icw1um/my_doctor_told_me_i_had_a_short_attention_span/
dadjokes,2020-08-20 15:44:56,What clay animated movie makes you throw up ,id9l9j,1,0,Wallace and vomit,https://www.reddit.com/r/dadjokes/comments/id9l9j/what_clayanimated_movie_makes_you_throw_up/
dadjokes,2020-08-20 19:14:33,When I told my teacher that I wasn t able to remember well in the exam  this is what she said ,idda31,0,0,Read more,https://www.reddit.com/r/dadjokes/comments/idda31/when_i_told_my_teacher_that_i_wasnt_able_to/
dadjokes,2020-08-20 06:42:56,I got mugged by some geese,id30t6,4,1,They took all my bread,https://www.reddit.com/r/dadjokes/comments/id30t6/i_got_mugged_by_some_geese/
dadjokes,2020-08-20 05:40:23,I spilled spot remover on my dog,id242u,7,0,Now he s gone,https://www.reddit.com/r/dadjokes/comments/id242u/i_spilled_spot_remover_on_my_dog/
dadjokes,2020-08-20 11:20:14,Im not addicted to brake fluid  I swear ,id6d0q,3,1,I can stop anytime,https://www.reddit.com/r/dadjokes/comments/id6d0q/im_not_addicted_to_brake_fluid_i_swear/
dadjokes,2020-08-20 01:19:52,Who was Jesus  least favorite relative ,icxtva,12,0,His Auntie Christ,https://www.reddit.com/r/dadjokes/comments/icxtva/who_was_jesus_least_favorite_relative/
dadjokes,2020-08-20 14:41:18,The other day someone asked me what I thought of Kipling   ,id8otl,1,1,I said  I m not sure  I ve never kippled    Thank you I ll be here all week,https://www.reddit.com/r/dadjokes/comments/id8otl/the_other_day_someone_asked_me_what_i_thought_of/
dadjokes,2020-08-19 23:26:03,How many opticians does it take to change a light bulb ,icvnuj,16,3,One or two  One or two,https://www.reddit.com/r/dadjokes/comments/icvnuj/how_many_opticians_does_it_take_to_change_a_light/
dadjokes,2020-08-20 06:52:07,I was reading a great book about an immortal dog the other day ,id35gc,5,1,It was impossible to put down,https://www.reddit.com/r/dadjokes/comments/id35gc/i_was_reading_a_great_book_about_an_immortal_dog/
dadjokes,2020-08-19 13:37:11,My three year old girl asked me   Where does poo come from   I was a little uncomfortable but decided to give her an honest explanation  so I explained   You just ate breakfast  yes  ,icl82r,98,12,   Yes   she replied    Well  the food goes into our tummies and our bodies take out all the good stuff  then whatever is left over  comes out of our bottoms when we go to the toilet  And  that   is poo    She looked a little perplexed  stared at me in stunned silence for a few seconds and asked   And Tigger  ,https://www.reddit.com/r/dadjokes/comments/icl82r/my_three_year_old_girl_asked_me_where_does_poo/
dadjokes,2020-08-20 05:35:06,My friend got me a prostitute for my birthday  but he didn t know I m turned off by bad teeth ,id215r,6,0,I didn t check though because you don t look a gift whore in the mouth,https://www.reddit.com/r/dadjokes/comments/id215r/my_friend_got_me_a_prostitute_for_my_birthday_but/
dadjokes,2020-08-20 03:30:40,I tried to trademark an unit for pressure   ,id01wm,7,2,But the patent office wouldn t have a bar of it,https://www.reddit.com/r/dadjokes/comments/id01wm/i_tried_to_trademark_an_unit_for_pressure/
dadjokes,2020-08-19 19:23:02,Can you believe California is having an electric shortage  Richard Ricity should run for governor,icquaf,28,3,This way the people can elect Ricity   The campaign would be  Elect Rick ,https://www.reddit.com/r/dadjokes/comments/icquaf/can_you_believe_california_is_having_an_electric/
dadjokes,2020-08-19 22:38:22,I think I might sell my hoover,icupu5,16,2,It s just collecting dust,https://www.reddit.com/r/dadjokes/comments/icupu5/i_think_i_might_sell_my_hoover/
dadjokes,2020-08-20 17:13:29,Why do animals win at poker ,idb19x,0,0,Because they cheetah,https://www.reddit.com/r/dadjokes/comments/idb19x/why_do_animals_win_at_poker/
dadjokes,2020-08-19 18:34:49,What do you call a cow without legs ,icpx6u,30,14,Ground meat,https://www.reddit.com/r/dadjokes/comments/icpx6u/what_do_you_call_a_cow_without_legs/
dadjokes,2020-08-19 08:52:00,What do you call a fish wearing a tie,ici1ux,176,10,Sofishticated,https://www.reddit.com/r/dadjokes/comments/ici1ux/what_do_you_call_a_fish_wearing_a_tie/
dadjokes,2020-08-20 12:46:32,Last winter it was cold so I walked into my bank wearing a scarf over my face  and the cashier went berserk  I went again yesterday wearing a mask   ,id7be6,0,0, And she still went berserk   ,https://www.reddit.com/r/dadjokes/comments/id7be6/last_winter_it_was_cold_so_i_walked_into_my_bank/
dadjokes,2020-08-20 03:58:25,My girlfriend asked me if I could help bleach her hair  To my response ,id0hq7,5,2,I d rather dye,https://www.reddit.com/r/dadjokes/comments/id0hq7/my_girlfriend_asked_me_if_i_could_help_bleach_her/
dadjokes,2020-08-20 02:53:05,Why do hummingbirds hum ,iczg3r,6,0,They don t know the words,https://www.reddit.com/r/dadjokes/comments/iczg3r/why_do_hummingbirds_hum/
dadjokes,2020-08-19 21:31:36,Can the coronavirus survive on Mars if it ends up on a SpaceX rocket  ,icte36,15,1, a lone mask  wants to know,https://www.reddit.com/r/dadjokes/comments/icte36/can_the_coronavirus_survive_on_mars_if_it_ends_up/
dadjokes,2020-08-19 05:05:47,To the person that invented the number 0,icev4j,323,17,Thanks for nothing,https://www.reddit.com/r/dadjokes/comments/icev4j/to_the_person_that_invented_the_number_0/
dadjokes,2020-08-20 04:52:22,I got an anti fatigue mat for my desk ,id1d1c,5,0,I couldn t stand to work without it,https://www.reddit.com/r/dadjokes/comments/id1d1c/i_got_an_antifatigue_mat_for_my_desk/
dadjokes,2020-08-19 23:11:31,I stopped by a roadside farm where I saw a sign that said  DUCK  EGGS  ,icvdl7,11,2,I was contemplating the position of the comma when it hit me,https://www.reddit.com/r/dadjokes/comments/icvdl7/i_stopped_by_a_roadside_farm_where_i_saw_a_sign/
dadjokes,2020-08-20 01:22:37,Mike Tyson and I were talking about our friend Sarah who had just gotten into town  I asked   so  how did she get from L A  to here   He replied   ,icxvrk,6,0, Theraflu  ,https://www.reddit.com/r/dadjokes/comments/icxvrk/mike_tyson_and_i_were_talking_about_our_friend/
dadjokes,2020-08-19 19:47:20,Why did Mozart kill all of his chickens ,icrc2w,19,1,When he asked them who was the best composer they all replied  Bach Bach ,https://www.reddit.com/r/dadjokes/comments/icrc2w/why_did_mozart_kill_all_of_his_chickens/
dadjokes,2020-08-19 14:41:14,Studying Chemistry at the moment  I just learned that Sulphuric acid should never be left in a metal beaker  ,icm11i,48,10,  It s an oxidant waiting to happen,https://www.reddit.com/r/dadjokes/comments/icm11i/studying_chemistry_at_the_moment_i_just_learned/
dadjokes,2020-08-20 02:53:37,What do you say when the Chinese are being fascists in Tiananmen ,iczgef,4,3,No tank  you,https://www.reddit.com/r/dadjokes/comments/iczgef/what_do_you_say_when_the_chinese_are_being/
dadjokes,2020-08-19 22:58:05,I recently dropped and broke a  shatter proof  ruler,icv3on,9,2,My disappointment is immeasurable,https://www.reddit.com/r/dadjokes/comments/icv3on/i_recently_dropped_and_broke_a_shatterproof_ruler/
dadjokes,2020-08-20 00:47:01,What do you call a 13 year old muslim stuck in self isolation ,icx7uv,8,1,A Qur anteen,https://www.reddit.com/r/dadjokes/comments/icx7uv/what_do_you_call_a_13_year_old_muslim_stuck_in/
dadjokes,2020-08-19 19:11:54,How do you refer to cheese in Japan  ,icqmir,19,4,Parme san,https://www.reddit.com/r/dadjokes/comments/icqmir/how_do_you_refer_to_cheese_in_japan/
dadjokes,2020-08-20 02:25:23,How many Rabbi does it take to bake bread ,icyzby,6,0,As many as you want just don t use eleaven,https://www.reddit.com/r/dadjokes/comments/icyzby/how_many_rabbi_does_it_take_to_bake_bread/
dadjokes,2020-08-19 22:03:38,My son is involved in the school music program   ,icu0xi,11,3,I told him i offered his director some assistance  They said yes   Now I get to be a band aid,https://www.reddit.com/r/dadjokes/comments/icu0xi/my_son_is_involved_in_the_school_music_program/
dadjokes,2020-08-19 18:23:56,How do you fix kleptomania ,icppvg,23,6,You take something for it,https://www.reddit.com/r/dadjokes/comments/icppvg/how_do_you_fix_kleptomania/
dadjokes,2020-08-19 22:23:37,What do you get when you cross a vegetable patch with a dinosaur ,icufae,10,0,Squash,https://www.reddit.com/r/dadjokes/comments/icufae/what_do_you_get_when_you_cross_a_vegetable_patch/
dadjokes,2020-08-20 19:35:06,Just got the results of my COVID test and I m positive   ,iddo9m,0,0,That I don t have COVID,https://www.reddit.com/r/dadjokes/comments/iddo9m/just_got_the_results_of_my_covid_test_and_im/
dadjokes,2020-08-20 04:52:46,You won t believe it  but I lost over 100 pounds  ,id1da2,4,2,I was robbed in England   ,https://www.reddit.com/r/dadjokes/comments/id1da2/you_wont_believe_it_but_i_lost_over_100_pounds/
dadjokes,2020-08-19 23:01:30,What can you do if your child doesn t get a place in daycare ,icv67e,7,4,You can send it to the Army  They always have places left in the infantry,https://www.reddit.com/r/dadjokes/comments/icv67e/what_can_you_do_if_your_child_doesnt_get_a_place/
dadjokes,2020-08-19 19:34:36,What do you call a funny mexican,icr2o0,14,5,El mao,https://www.reddit.com/r/dadjokes/comments/icr2o0/what_do_you_call_a_funny_mexican/
dadjokes,2020-08-19 20:16:53,Son  Dad can you tell me what a solar eclipse is ,icrxb6,13,0,Dad  No sun  Son  Why not,https://www.reddit.com/r/dadjokes/comments/icrxb6/son_dad_can_you_tell_me_what_a_solar_eclipse_is/
dadjokes,2020-08-19 17:39:20,I let my out of town girlfriend know her vegetable service delivered a package today and I had some bad news ,icov8o,18,3,She asked what had happened to it   I told her the box had a leek in it,https://www.reddit.com/r/dadjokes/comments/icov8o/i_let_my_out_of_town_girlfriend_know_her/
dadjokes,2020-08-19 21:52:54,My friend and I went fishing  He cast out first and got a bite  So he reeled in a trumpet  Then he cast out in a different area  got a bite and reeled in a clarinet ,ictt8t,7,3,After he cast out the third time  I said  maybe you ll reel in a bass soon  ,https://www.reddit.com/r/dadjokes/comments/ictt8t/my_friend_and_i_went_fishing_he_cast_out_first/
dadjokes,2020-08-19 11:23:34,My brother  who stutters alot  went to prison   ,icjqhl,51,0,Its a shame that he won t finish his sentence,https://www.reddit.com/r/dadjokes/comments/icjqhl/my_brother_who_stutters_alot_went_to_prison/
dadjokes,2020-08-19 21:23:10,Why do electricians make good music  ,ict85r,8,3,They always have an extension chord,https://www.reddit.com/r/dadjokes/comments/ict85r/why_do_electricians_make_good_music/
dadjokes,2020-08-19 20:21:53,Did you guys see the cow with facial hair ,ics0rb,8,3,It has a moo stache,https://www.reddit.com/r/dadjokes/comments/ics0rb/did_you_guys_see_the_cow_with_facial_hair/
dadjokes,2020-08-20 04:09:08,How do you get the mafia out of pro sports ,id0o07,3,0,You request a sit down,https://www.reddit.com/r/dadjokes/comments/id0o07/how_do_you_get_the_mafia_out_of_pro_sports/
dadjokes,2020-08-19 14:49:59,French bombe,icm573,21,4,Did you hear about the French castle made of cheese that exploded   There was de brie everywhere,https://www.reddit.com/r/dadjokes/comments/icm573/french_bombe/
dadjokes,2020-08-19 11:49:30,Why did the drowning Pharoah refuse to ask for help ,ick0bk,40,3,he was in de Nile,https://www.reddit.com/r/dadjokes/comments/ick0bk/why_did_the_drowning_pharoah_refuse_to_ask_for/
dadjokes,2020-08-19 19:09:25,My brother and I were just reminiscing about the herb garden our family had when we were kids ,icqkrb,10,3,Good thymes,https://www.reddit.com/r/dadjokes/comments/icqkrb/my_brother_and_i_were_just_reminiscing_about_the/
dadjokes,2020-08-19 22:13:08,I was cleaning the coffee filter and forgot to rinse the grounds down the sink ,icu7qx,5,2,My wife comes up and asks me why I forgot to clean the sink  I said  What  Am I grounded  ,https://www.reddit.com/r/dadjokes/comments/icu7qx/i_was_cleaning_the_coffee_filter_and_forgot_to/
dadjokes,2020-08-19 23:05:42,A drunk man eating chips wanders into a monastery,icv9bz,4,0,While wandering around he bumps into a old man in robes cooking    With a grin the drunk man asks  Are you the fish friar     No brother  he replied  I m the chip monk ,https://www.reddit.com/r/dadjokes/comments/icv9bz/a_drunk_man_eating_chips_wanders_into_a_monastery/
dadjokes,2020-08-19 14:53:45,What do you call two pigs mating ,icm6zf,17,3,Makin  bacon,https://www.reddit.com/r/dadjokes/comments/icm6zf/what_do_you_call_two_pigs_mating/
dadjokes,2020-08-20 00:26:25,What do you call a cow with no legs ,icwtp0,3,3, paraplegic,https://www.reddit.com/r/dadjokes/comments/icwtp0/what_do_you_call_a_cow_with_no_legs/
dadjokes,2020-08-19 10:03:57,Why are there no Vampire stories that take place in Africa ,icivv2,42,8,I thought about this for awhile  then it hit me that Vampires are weak to holy water  The rains are blessed down in Africa,https://www.reddit.com/r/dadjokes/comments/icivv2/why_are_there_no_vampire_stories_that_take_place/
dadjokes,2020-08-19 15:37:05,One day a guy went to an aquarium   but they had only one animal,icmt6s,16,5,it was a crab,https://www.reddit.com/r/dadjokes/comments/icmt6s/one_day_a_guy_went_to_an_aquarium_but_they_had/
dadjokes,2020-08-20 05:57:29,A lot of Chinese people enjoy discussing their love of citrus ,id2dkl,2,0,They particular like to talk all things Mandarin,https://www.reddit.com/r/dadjokes/comments/id2dkl/a_lot_of_chinese_people_enjoy_discussing_their/
dadjokes,2020-08-19 22:09:48,While having dinner  I just came to the conclusion that tofu is highly overrated ,icu5gv,5,2,It s just a curd to me,https://www.reddit.com/r/dadjokes/comments/icu5gv/while_having_dinner_i_just_came_to_the_conclusion/
dadjokes,2020-08-19 20:46:57,My test came back negative ,icsihy,5,0,Too bad it was my IQ test,https://www.reddit.com/r/dadjokes/comments/icsihy/my_test_came_back_negative/
dadjokes,2020-08-19 23:09:57,For a long time  I though I had a dog named Yule  When he died  I found out he was just a wrench ,icvcg7,3,0,He was a good copper spanner  Yule,https://www.reddit.com/r/dadjokes/comments/icvcg7/for_a_long_time_i_though_i_had_a_dog_named_yule/
dadjokes,2020-08-19 17:07:43,If Frodo was the President of the Fellowship  what position would Gandalf have ,icoabv,9,1,Chief of Staff,https://www.reddit.com/r/dadjokes/comments/icoabv/if_frodo_was_the_president_of_the_fellowship_what/
dadjokes,2020-08-19 15:33:57,My buddy Lee asked me if I knew what zero degrees Kelvin was called    ,icmrjh,14,2,My response   absolutely ,https://www.reddit.com/r/dadjokes/comments/icmrjh/my_buddy_lee_asked_me_if_i_knew_what_zero_degrees/
dadjokes,2020-08-19 10:56:54,What happens when two weed companies merge together ,icjg7o,25,1,They become a joint venture,https://www.reddit.com/r/dadjokes/comments/icjg7o/what_happens_when_two_weed_companies_merge/
dadjokes,2020-08-19 20:37:01,There was a girl I work with named Novalee  and one day I asked her how her name was spelled ,icsbmg,5,0,She looked at me and said   Guess   I responded with   Wow  That s NOTHING like how it s spelled   And from that moment on I would only call her Guess,https://www.reddit.com/r/dadjokes/comments/icsbmg/there_was_a_girl_i_work_with_named_novalee_and/
